date,title,type_new
,remezon uefa presidente ceferin tomar radical decision futuro entidad,Deportes
,copa davis 2024 colombia rival serie septiembre grupo mundial i,Deportes
,confirmar dt sao paulo salida james rodriguez club,Deportes
,carlos antonio velez lanzo duro criticar var gol convalidado millonario frente america,Deportes
,pese derrota faria mostro satisfecho partido realizar america bogota,Deportes
,figura atletico nacional seguir europa,Deportes
,video miguel angel borja racha goleadora river plate crucial triunfo excursionista copa argentino,Deportes
,millonario fuerte casa derroto america cali clasico fecha 5,Deportes
,salario james rodriguez sao paulo,Deportes
,baja capitan adrian ramos america cali anuncio nomina convocado clasico millonario,Deportes
,mala noticia deportivo cali fecha sancion tendrar fabian castillo,Deportes
,insistir argentina luis chino sandoval equipo mostrar inter delantero deportivo cali,Deportes
,davinson sanchez presente turquia anoto victoria galatasaray,Deportes
,carlos antonio velez arremetir james rodriguez salida sao paulo,Deportes
,golpe autoridad america cali visitar millonario duelo estelar fecha 5 liga,Deportes
,liverpool candidato reemplazar klopp,Deportes
,james rodriguez tomo sorpresivo decision futuro são paulo,Deportes
,david ospina volver revelar fecha regreso lesion nassr,Deportes
,luis diaz recibir importante nominacion liverpool votar colombiano,Deportes
,conocer razón messi jugo medio hora despedida inter miami gira asiatico,Deportes
,dani alves hara esperado declaracion juicio presunto violacion,Deportes
,america cali anuncio fecha entrega kit abonado enterese,Deportes
,capitulo juicio dani alves exfutbolista brasileño habria borracho victima nervioso,Deportes
,millonario problema copa libertadores pedir solución,Deportes
,fulminante mensaje dejar mourinho jugador roma regreso anillo habian regalar,Deportes
,polemico gol medellin ganar deportivo cali debio anular él opinar experto,Deportes
,contundente respuesta atletico nacional fichaje bomba teofilo gutierrez,Deportes
,serio equipo luis muriel habria ganar pulso historico fpc,Deportes
,fernando gaviria catedra ganar embalaje etapa 1 tour colombia 2024,Deportes
,caso red bull fecha declaracion christian horner presunto comportamiento inapropiado,Deportes
,tour colombia 2024 horario punto cierre vial boyaca cundinamarca,Deportes
,murio miguel angel gonzalez mitico arquero real madrid padecer grave enfermedad,Deportes
,santo fe vs bucaramanga consulte horario partido posible alineación ver él,Deportes
,sorteo fase grupo copa libertador 2024 revelar fecha oficial,Deportes
,oscuro panorama deportivo cali tabla descenso derrota medellin,Deportes
,arder lucha cima premier league city aprovechar resbalon liverpool diaz acercar punta liga,Deportes
,laliga denunciar gesto obsceno sufrio delantero lucas ocampos rayo vallecano vs sevilla,Deportes
,razon exjugador deportivo cali demar argentino juniors fifa,Deportes
,duro golpe nairo quintán iniciar tour colombia,Deportes
,razón egan nairo favorito ganar tour colombia,Deportes
,jaime pava quedo satisfecho entrega equipo pese caer medellin,Deportes
,cumplio expectativa debut jarlan barrera camiseta deportivo cali derrota medellin,Deportes
,deportivo cali intentar independiente medellin cayo minimo diferencia,Deportes
,tour colombia prueba nivel nairo quintán entrevista,Deportes
,independiente medellin 1   0 deportivo cali victoria cuadro poderoso liga betplay revivir mejor momento,Deportes
,velez palo james rodriguez duro comparacion,Deportes
,premier league manchester city remontar brentford acercar liverpool lucha liderato,Deportes
,dt sao paulo james rodriguez lesion cronico afectar psicologicamente,Deportes
,sorpresa preolimpico sudamericano paraguay vencio brasil acercar paris 2024,Deportes
,burlo yerry mina gesto leandro paredes colombiano partido roma vs cagliari,Deportes
,millonario lesion mackalister silva,Deportes
,escuderia red bull salir tremendo problema mes gp barein,Deportes
,paso molestia hincha sao paulo pataleta james rodriguez,Deportes
,chef revelo secreto eterno juventud cristiano ronaldo clave alimentacion,Deportes
,mundial futbol 2026 calendario partido jugar texas,Deportes
,orgullo vallecaucano gustavo sanchez ganar medalla mundial natacion artistica doha 2024,Deportes
,lindo caicedo integrar top mejor jugadora sub20 sudamerica colombiano,Deportes
,james rodriguez tendriar plan sao paulo vincular historico europeo,Deportes
,costariar peso colombiano inauguracion mundial 2026,Deportes
,martes comenzar copa libertador 2024 club colombiano partido,Deportes
,mbappe estario cerca real madrid reconocido periodista detalle transferencia,Deportes
,tour colombia pedalista sensación previo iniciar competencia,Deportes
,video l carlos antonio velez cobrar alvaro montero gol tolima estudiante,Deportes
,entrenador river plate deshacer elogio borja marcar triplete velez sarsfield,Deportes
,nairo quintán egan bernal cita casa llevar foco,Deportes
,hector cardenas fcf habrio poner fecha definir futuro reemplazo,Deportes
,pagar ciento dolar messi ver,Deportes
,gobierno hong kong exigir respuesta ausencia messi partido inter amistoso jugado pais,Deportes
,medellin vs deportivo cali canal hora partido vivo fecha 4 liga betplay,Deportes
,dani alves juicio primero imagen jugador año prision,Deportes
,medellin vs deportivo cali convocado jaime pava partido atanasio,Deportes
,insolito partido historia futbol tendrar repetir él decision var,Deportes
,video miguel angel borja triplete river plate goleada velez sarsfield copa liga argentina,Deportes
,seguir senda deportivo cali visitar lunes dim idea sumar triunfo,Deportes
,inter milan derroto juventus sacar diferencia punto liderato serie italia,Deportes
,james rodriguez sao paulo coronar campeon supercopa brasil palmeira,Deportes
,oficial fifa fixture sede copa mundo unidos canada mexico 2026,Deportes
,dramatico atletico madrid amargo fiesta real madrid santiago bernabeu liga españa,Deportes
,pataleta james rodriguez sao paulo colombiano viajar supercopa brasil palmeiras,Deportes
,america cali revelo medico adrian ramos salir lesionado partido patriota,Deportes
,mundial futbol fifa 2026 disputar yorknueva jersey,Deportes
,alcanzar partido medico deportivo cali lesion luis sandoval,Deportes
,momento correcto cambio primero palabra lewis hamilton anuncio salida mercedes ferrari,Deportes
,novela kylian mbappe fichar real madrid diario frances,Deportes
,luis fernando muriel dejariar atalanta mitad año futuro delantero colombiano,Deportes
,enderezar rumbo america cali apostar triunfo duelo cuarto fecha patriota,Deportes
,argentino empatar uruguay avanzar grupo fase i preolimpico jugar ronda,Deportes
,murio osvaldo dominguez laureado dirigente olimpia padre presidente conmebol,Deportes
,america cali darir mano ayudita deportivo cali esperar rival patio,Deportes
,novedad convocado america cali partido patriota fecha 4 liga i2024,Deportes
,millonario buscar extremo jugar messi jugador conocido alberto gamero,Deportes
,colombia inicio desventaja serie luxemburgo copa davis,Deportes
,quedar tabla posición liga betplay i2024 finalizacion fecha 3 lider,Deportes
,sueño grupo porrista club cali sport team colombia buscar apoyo mundial unidos,Deportes
,espera jarlan barrera oficializar deportivo cali,Deportes
,paso nigerio republica democratica congo avanzar semifinal copa africano nación,Deportes
,mostrar juego sufrimiento psg derroto racing estrasburgo ligar 1,Deportes
,regreso titular millonario anuncio nomina convocado enfrentar deporte tolima,Deportes
,tolima vs millonario vivo posible formación horario online liga betplay,Deportes
,jaguar vs bucaramanga vivo horario ver él tv,Deportes
,america cali vs patriota horario partido vivo,Deportes
,liverpool luis diaz visitar arsenal fecha hora canal partidazo premier league,Deportes
,argentina vs uruguay preolimpico sub 23 hora jugar posible formación,Deportes
,luis tejada dramatico testimonio relatar ultimo minuto vida,Deportes
,dinero dejar recibir colombia juego panamericano,Deportes
,derrota responsabilidad cesar faria tecnico america perder tolima,Deportes
,novedad grupo revelado jugar proximo edicion league cup 2024,Deportes
,america cali roto nomina cayo deporte tolima liga betplay,Deportes
,deporte tolima 2   1 americo victoria pijao liga betplay,Deportes
,gol roger martinez juan fernando quintero racing goleo tigre argentina,Deportes
,colegio berchmans cali celebrar noventa año importante actividad deportivo detalle,Deportes
,golfista caleño mateo gomez santiago rivas disputar bogota cupo torneo astaro,Deportes
,deportivo cali tomar aire movimiento clave tecnico pava vencer fortaleza,Deportes
,colegio jefferson inaugurar decir juego nacional participacion catorce institución pais,Deportes
,millonario alianza fc dejar escapar punto estadio campin,Deportes
,javier hernandez bonnet importante anuncio seguidor pediar tiempo,Deportes
,tomas angel dejar fpc presentar equipo,Deportes
,idolo ovacionar radamel falcao partido atletico madrid rayo vallecano,Deportes
,video espectacular anotacion luis diaz goleada liverpool chelsea premier league,Deportes
,colombia vs bolivia horario preolimpico sub 23 directo,Deportes
,curioso reaccion juan pablo montoya reconocimiento internacional recibio,Deportes
,millonario vs alianza fc posible alineación partido directo,Deportes
,descartado nacional pereira portero venezolano wuilker fariñez equipo conozcalo,Deportes
,premier league colombiano jugar causar sensacion torneo,Deportes
,subastaran servilleta messi firmo barcelona fortuna pedir,Deportes
,paso juego panamericano 2027,Deportes
,deporte tolima vs america cali hora canal vivo partido,Deportes
,pereira vs deportivo pasto horario partido vivo,Deportes
,atencion dejar estafar america cali anunciar vacante jugar imagen club,Deportes
,deportivo cali romper sequia sorprendente lider liga betplay fortaleza,Deportes
,adrian ramos gol alcanzar historico marca america cali,Deportes
,convocado deportivo cali enfrentar fortaleza fecha 3 liga betplay,Deportes
,rigoberto urir revelo miedo hacer él realidad,Deportes
,duro confesion xavi hernandez anunciar dejar barcelona sentir diario valer,Deportes
,equidad vs santa fe liga betplay hora ver él vivo,Deportes
,video golazo hondureño david ruiz sensacion inter miami messi suarez,Deportes
,embolatan panamericano revelar petro solicito reunion presidente panam sports,Deportes
,deportivo cali vs fortaleza fc horario partido posible alineación,Deportes
,peor presentación seleccion colombia derrotar venezuela torneo preolimpico,Deportes
,video espectacular presentacion daniel muñoz jugador crystal palace inglaterra,Deportes
,jugar jornada liga betplay 2024i,Deportes
,alvaro montero impresionante cifra millonario habrio rechazar traspaso portero,Deportes
,nacional ilusionar hincha jugador talla internacional regresar viejo conocido,Deportes
,nacional ruta 2024 conocer fecha recorrido participante destacado,Deportes
,millonario vs junior posible alineación superliga 2024,Deportes
,cesar faria emotivo mensaje hinchada america cali voz pueblo mandar,Deportes
,chelsea intensificar esfuerzo contratar futbolista colombiano,Deportes
,estadio america cali nombre capacidad lujo,Deportes
,luis diaz busca hora canal semifinal fulham vs liverpool,Deportes
,brasil duro golpe colombia cuenta seleccion clasificar olimpico paris,Deportes
,millonario vs junior hora canal superliga 2024,Deportes
,millonario nacional seria sorprendente equipo wuilker fariñez colombia,Deportes
,listo liga femenino 2024 seran rival america deportivo cali fecha,Deportes
,partido infarto atletico madrid venir real madrid eliminar copa rey,Deportes
,palmirano kevin quintero escoger deportista colombiano 2023 premio altius coc,Deportes
,desear colombia ojala campeón mensaje arturo vidal dar él llegada america cali,Deportes
,junior aprovechar localia derroto millonario juego ida superliga 2024,Deportes
,junior 1   0 millonario rojiblanco fuerte casa ventaja superliga betplay revivir mejor momento,Deportes
,cayo nieve barranquilla curioso forma hincha junior burlar él periodista partido superliga millonario,Deportes
,santiago arias vuelta europa equipo interesado fichaje,Deportes
,golazo james rodriguez lucir entrenamiento sao paulo,Deportes
,atlas cp historia equipo valle coronar campeon participacion babyfutbol sala femenino,Deportes
,camiseta junior barranquilla 2024,Deportes
,napoli dejar fiorentina colombiano yerry minar vencer él supercopa italiano,Deportes
,novela baldomero perlazar oficializar equipo forma particular,Deportes
,poner punto 2024 deportivo cali america intensificar labor arranque liga,Deportes
,atletico madrid vs real madrid duelo destacado octavo copa rey barcelona enfrentar equipo division,Deportes
,tiger woods nike poner relacion 27 año,Deportes
,academia rafa nadal llego club campestre cali inicio campus 102 persona,Deportes
,franz beckenbauer kaiser aleman conquistar europa mundo exitoso carrera,Deportes
,lider gregario correria egan bernal tour francia 2024,Deportes
,urgente franz beckenbauer leyenda futbol aleman mundial fallecio 78 año edad,Deportes
,alejandro char detalle reunion cumplirar martes tratar salvar juegos,Deportes
,america cali tendriar mira reemplazo portilla campeon nacional santo fe,Deportes
,marcela gomez conto detalle catalina usme america cali futbol mexicano,Deportes
,video increible reaccion klopp golazo luis diaz liverpool,Deportes
,video papa luis diaz volver viral celebrar gol hijo estadio arsenal,Deportes
,indirecto james rodriguez carlos antonio velez estallo conocer él destino kevin castaño,Deportes
,luis diaz titular partido fa cup liverpool vs arsenal,Deportes
,video marcela gomez destapo hablar situacion america cali llegada presidencia,Deportes
,increible jugador recibir amenaza muerte fallar penal,Deportes
,rafael nadal confirmar jugar abierto australia 2024 razon,Deportes
,liverpool luis diaz enfrentar arsenal hora canal partidazo fa cup,Deportes
,bombazo fpc nacional cerca firmar arquero exmillonarios procedente europa,Deportes
,2024 sonriir james rodriguez astrologo mauricio puerta predecir año positivo 10′ seleccion colombia,Deportes
,drama qatar delantero andy delort desplomo convulsiono campo,Deportes
,inter derroto hellas verona terminar lider vuelta serie,Deportes
,lille propinar goleada escandaloso golden lion copa francia diferencia paso 10 gol,Deportes
,2024 año reto objetivo america cali deportivo cali,Deportes
,deportivo cali equipo azucarero presentar refuerzo liga 2024,Deportes
,luto futbol murio mario zagallo unico tetracampeon mundo jugador dt brasil,Deportes
,familia unida jamas vencer lazo sangre presente america cali 2024,Deportes
,boca juniors presentar oficialmente diego martinez director tecnico,Deportes
,mhoni vidente hablar selección ganar copa america 2024,Deportes
,panam sports enviar carta invitacion país querer organizar juego panamericano 2027,Deportes
,confirmar millonario oficial tercer refuerzo lujo,Deportes
,convocado seleccion colombia sub23 torneo preolimpico,Deportes
,fernando diniz destituir tecnico seleccion brasil,Deportes
,sorpresa luis diaz ausente nomina jugador caro mundo,Deportes
,kevin castaño salto europa joya seleccion colombia anunciar club,Deportes
,presidente comite olimpico panamericano luz,Deportes
,perder fuerte mensaje mariana pajon quitar sede barranquilla juego panamericano 2027,Deportes
,brasil ednaldo rodrigues volver presidencia confederacion brasileño futbol,Deportes
,revelar millonada ganar james brasil aumento sueldo fortuna,Deportes
,dueño betsson patrocinador nacional,Deportes
,america cali anuncio sexto refuerzo llegar exterior,Deportes
,atencion adrian ramos seguirir america cali diablo anunciar renovacion 2024,Deportes
,ciro solano presidente comite olimpico sincera perder juego panamericano dificil volver organizar tipo evento,Deportes
,marcela gomez hija tulio gomez presentar presidenta america cali,Deportes
,reves panamericano recordar caida gp formula 1 barranquilla,Deportes
,marcela gomez hija tulio gomez presentar presidenta america cali,Deportes
,wilmar roldan ingreso prestigioso ranking codear mejor arbitro mundo,Deportes
,mourinho rival colombia copa america portugues hablar inter brasil,Deportes
,malo hora futbolista colombiano jugador devaluado mercado,Deportes
,sentir competitivo rafael nadal ganar partido consecutivo regreso competencia,Deportes
,ilusionar hincha real madrid mbappe hablar futuro deportivo frances,Deportes
,psg supero toulouse coronar campeon supercopa francia,Deportes
,sorpresivo salida deportivo cali miembro cuerpo tecnico abandonar cuadro azucarero,Deportes
,juan carlos osorio vuelta brasil tecnico colombiano anunciar equipo,Deportes
,partido intenso lleno emoción girona derrotar atletico madrid compartir liderato laliga,Deportes
,nacional tomar angel salir equipo reforzaria poderoso rival,Deportes
,millonario arranco pretemporado ausencia,Deportes
,mercado fichaje 2024 santiago giordana importante inconveniente firmar millonario,Deportes
,jose mourinho inesperado rival seleccion colombia copa america,Deportes
,razón barranquilla colombia perder sede juegos panamericano 2027,Deportes
,real madrid agitar liga españa importante resultado mallorca,Deportes
,oficial barranquilla sede juego panamericano 2027,Deportes
,santo fe genero burla red social camiseta helado chicle,Deportes
,llamativo imagen publicado red america cali iniciar camino 16′,Deportes
,america cali sentido adio capitana catalina usme casa,Deportes
,deportivo cali importante anuncio cara inicio liga betplay mision estrella verde comenzar,Deportes
,cristiano ronaldo leo messi sorprender preseleccion 11 ideal fifa fifpro 2023 nominado,Deportes
,luto futbol murio reconocido deportista madre ataque rusia   ucrania,Deportes
,maleta listo juan camilo portilla viaje serio clave futuro,Deportes
,junior barranquilla agitar fichaje 2024 estelar contratacion argentina,Deportes
,preocupacion werder bremen rafael santos borrar abandono entrenamiento miercol,Deportes
,atencion barranquilla perderio sede juego panamericano 2027 insolito motivo,Deportes
,referente seleccion colombia llegar boca juniors decision dependeria riquelme,Deportes
,historico academia rafa nadal estara cali llegar america latino,Deportes
,inter milan eligiir reemplazo juan guillermo cuadrado,Deportes
,video revelar imagen ultimo momento medallista olimpico kiplagat morir,Deportes
,frank fabra desatar furia hincha boca juniors insolito razon pasar,Deportes
,jhon jader durar pretendiente lujo gigante italiano iria fichaje,Deportes
,cali plano internacional felipe montoya secretario deporte municipal,Deportes
,año dorado reto deporte colombiano 2024,Deportes
,sorpresa millonarios daniel ruiz realizar anuncio hincha azul pasar alto,Deportes
,cesar faria quedar pan queso universitario deporte peru confirmar tecnico,Deportes
,falcao garcia presente victoria rayo vallecano getafe laliga,Deportes
,copa libertador 2024 bombo colombiano competencia,Deportes
,millonario seria refuerzo equipo detalle clave contrato,Deportes
,ingrid guerra regresar deportivo cali paso atletico mineiro,Deportes
,america cali femenino quedar dt gustavo pineda entrenador escarlata,Deportes
,capricho jurgen klopp poner pecho critica revelo razon sacar luis diaz partido liverpool newcastle,Deportes
,numero estadistica nilson castrillon jugador america cali,Deportes
,furor luis diaz impresionante jugada colombiano newcastle liverpool dejar pasar,Deportes
,juego olimpico 2024 seleccion colombia femenino preparar justo paris,Deportes
,bolillo gomez dirigirar equipo colombia detalle negociacion,Deportes
,america confirmar quinto refuerzo 2024 defensa cali,Deportes
,luis diaz burlo jurgen klopp pleno partido pataleta tecnico,Deportes
,impresionante inicio año egan bernal hora entrenamiento mil metro ascenso,Deportes
,revelar estario retrasar traspaso rafael santos borre inter porto alegre,Deportes
,video   lionel messi hijo mateo viral dominio balon,Deportes
,españa jenni hermoso declaración sentenciar caso rubial,Deportes
,brillante actuación luis diaz liverpool mover sustancialmente premier league,Deportes
,video   jurgen klopp perdio anillo matrimonio cancha gracioso momento anfield,Deportes
,rafael nadal sorpresivo actuacion brisbane año ausencia,Deportes
,futbol guerra palestino durisima declaración cara copa asia 2024,Deportes
,copa america olimpicos eurocopa evento deportivo importante disputar 2024 conocer fecha,Deportes
,video portero escocia jugar delantero marco tremendo golazo,Deportes
,tulio gomez lanzar perla piedra tirar hare estatua,Deportes
,franz beckenbauer mundo futbol preocupar salud leyenda,Deportes
,excompañero egan bernal acusar muerte esposa,Deportes
,mirada brisbane rafael nadal regreso doble,Deportes
,bomba real madrid habria poner fecha limitar mbappe decidir merengue hora clave operacion,Deportes
,juanito moreno ganar liga millonario jugar b equipo arquero,Deportes
,carlos bacca jugador futbol colombiano premio internacional,Deportes
,reconocido periodista argentino arremetio james rodriguez confundido,Deportes
,insolita decision tomar karim benzema sufrir numeroso critica aficionado alittihad,Deportes
,adrian ramos seguira america serio intento tulio gomez retener jugador,Deportes
,remezon america cali confirmar salida miembro importante club,Deportes
,destapar inconveniente hario tambalear llegada daniel bocanegra america cali,Deportes
,alex char aprovechar discurso posesion ilusionar hincha junior fichaje estrella,Deportes
,deportivo cali anuncio salida jugador campeon clave 10′,Deportes
,  vivo   mercado fichaje liga betplay seguir directo alto bajo colombia,Deportes
,catalina usme finalista premio reina america competir,Deportes
,car él ancelotti renovar real madrid dejar ver chispero brasil,Deportes
,atletico nacional buscar regreso idolo cuadro verdolaga preguntar franco armani,Deportes
,colombia mira fifa medida gobierno petro pasar,Deportes
,nairo quintán vivir regreso elite ciclismo gastar millonado lujo,Deportes
,luto futbol murio exjugador frances françois bracci,Deportes
,fichaje europa atletico nacional acordado jugador verdolaga,Deportes
,arsenal perdio west ham liverpool luis diaz convirtio campeon invierno inglaterra,Deportes
,gustavo ramirez olvidar deportivo cali oficializar equipo,Deportes
,deportivo pereira romper mercado fichaje iria campeon liga junior,Deportes
,salida america cali jorge soto exterior,Deportes
,agendese fecha carrera atletica tendrar colombia 2024,Deportes
,anunciar equipo competiran tour colombia,Deportes
,titular seleccion colombia mira napoli,Deportes
,angie vega entrenadora millonario femenino,Deportes
,millonario triste mensaje luto cara cierre año,Deportes
,fifa elogio james rodriguez emotivo mensaje bendicion lorenzo salio,Deportes
,club colombiano reemplazariir brasileño copa libertadores sancion fifa,Deportes
,promesa futbol colombiano serio compañero luis diaz liverpool,Deportes
,atencion mauricio romero presidente america cali,Deportes
,teofilo gutierrez aclarar fiscalia ibague acordar conciliar,Deportes
,america cali oficializar llegada defensa central 2024,Deportes
,jhon arias crack nominar premio rey america durisimo competencia colombiano,Deportes
,tramadol ingresar lista sustancia prohibido agencia mundial antidopaje razon,Deportes
,juan camilo portilla dejar america cali club argentina,Deportes
,expectativa sudamerica quedario tabla posición eliminatoria sudamericano fifa descalificar brasil,Deportes
,nadal volverir circuito atp miras retiro competencia,Deportes
,junior oficializo tercer refuerzo goleador ver rojiblanco,Deportes
,salir competencia atletico nacional david ospín equipo español fichar arquero seleccion colombia,Deportes
,manchester city vencio visita everton acercar liderato premier league,Deportes
,chelsea lograr agonico triunfo crystal palace premier league,Deportes
,lindo caicedo cerro broche oro 2023 colombiana meter top5 mejor jugadora iffhs,Deportes
,peru anuncio entrenador copa america eliminatoria sudamericano,Deportes
,atletico nacional oficializo tercer refuerzo volante campeon america cali,Deportes
,jugar fecha liga betplay 2024l,Deportes
,catalina usme despedir america cali seria equipo,Deportes
,millonario exjugador atletico nacional,Deportes
,novak djokovic lanza duro advertencia rafael nadal retorno circuito,Deportes
,america desprender jugador,Deportes
,teofilo gutierrez problema jugador ver instalación fiscalia,Deportes
,valer bicicleta usar egan bernal 2024,Deportes
,world tour 2024 ciclista colombiano participar,Deportes
,david ospina volver atletico nacional hincha ilusionar,Deportes
,eduardo mendez revelo sorpresivo motivo iago falque llegario santa fe,Deportes
,daniel mantilla volveria vestir verde 2024 cerrado afirmar,Deportes
,luis diaz asistencia triunfo liverpool premier league,Deportes
,actuacion magistral cristiano ronaldo goleada alnassr alittihad benzema,Deportes
,junior ganar millonario demanda porto luis diaz recibirir equipo,Deportes
,america cali anuncio contratacion temporada 2024,Deportes
,atencion yerson candelo dejar crespo hecho hincha junior tomaria destino,Deportes
,preocupacion jurgen klopp revelo importante detalle lesion luis diaz,Deportes
,campeon regresar america cali anuncio retorno arquero joel graterol,Deportes
,portero atletico nacional kevin mier club esperado futbol mexicano,Deportes
,crack cerca fichar deportivo cali,Deportes
,piloto juan pablo montoya hijo sebastian correr semana carrera cumbre valle,Deportes
,ratcliffe multimillonario dueño ineos convirtio propietario manchester united,Deportes
,chelsea volver sumar derrota premier quedar cuerda floja tecnico pochettino,Deportes
,oficial tecnico inter milan confirmar fecha regreso cancha cuadrado esperado,Deportes
,listado jugador america cali anunciaria navidad año temporada 2024,Deportes
