date,title,type_new
2024-02-17,videojuego mejor consola portatil 2024,Tecnologia
2024-02-16,usuario devolver apple vision pro razón,Tecnologia
2024-02-15,filtrar xiaomi 14 ultra bestia retar iphone 15 galaxy s24,Tecnologia
2024-02-14,observación ceo meta comentar interfaz usuario gafa bonito,Tecnologia
2024-02-13,youtuber experto tecnologia desarmo gafa realidad mixto mostro punto debil,Tecnologia
2024-02-10,1996 modelo popularizo,Tecnologia
2024-02-09,dejar cable inicie experiencia dispositivo tecnologico,Tecnologia
2024-02-09,afirmar ultimo actualizacion bloc nota incluir funcionalidad,Tecnologia
2024-02-09,marca meta playstation htc gafa realidad aumentado,Tecnologia
2024-02-08,pensar factura luz caracteristica,Tecnologia
2024-02-08,apple estario preparar modelo plegable iphone,Tecnologia
2024-02-06,samsung revelar celular anterior s24 llegar io,Tecnologia
2024-02-06,tecnologia función cable variar conforme especificación,Tecnologia
2024-02-06,novedad traer usuario opcion compartir pantalla,Tecnologia
2024-02-06,analizar analizar nivel ansiedad depresion trastorno estr,Tecnologia
2024-02-03,audifono prometer 80 hora reproduccion carga,Tecnologia
2024-02-02,electrodomestico deberiar desconectar reducir consumo energia,Tecnologia
2024-02-02,asistentir voz convenir comprar alexa google home,Tecnologia
2024-02-02,ventaja desventaja comprar robot aspiradoro,Tecnologia
2024-02-01,mcdonalds japon dispositivo encargado limpiar celular,Tecnologia
2024-02-01,xiaomi presentar serie redmi notar 13 celular valer millon,Tecnologia
2024-02-01,iphone 16 pro max revelar novedad importante telefono apple,Tecnologia
2024-02-01,samsung responder usuario pagar función ia,Tecnologia
2024-01-31,iphone paso bloquear telefono robar,Tecnologia
2024-01-30,seguridad informatico ciberataqu sonado historia deporte,Tecnologia
2024-01-28,2024 año computacion mudar cara,Tecnologia
2024-01-26,acer nitro 16 equipo entrada equilibrado,Tecnologia
2024-01-26,caracteristica precio disponibilidad vivo v30 v30 lite,Tecnologia
2024-01-26,apple vision pro comprar colombia gafa realidad mixto,Tecnologia
2024-01-26,honor x8b llegar colombia caracteristica precio lanzamiento,Tecnologia
2024-01-26,maestro utilizar alexa ayudar tarea nino,Tecnologia
2024-01-25,samsung galaxy s24 contar función ia ofrecer celular,Tecnologia
2024-01-25,samsung galaxy s24 iphone 15 precio celular poderoso mercado,Tecnologia
2024-01-24,macintosh apple celebrar cumpleaños numero 40 decada innovacion,Tecnologia
2024-01-22,galaxy s24 inteligente celular inteligencia artificial,Tecnologia
2024-01-19,optimizar computadora personal regreso clase,Tecnologia
2024-01-19,modelo celulares samsung barato comprar colombia,Tecnologia
2024-01-19,truco cargar rapido bateria celular,Tecnologia
2024-01-18,cristal corning gorilla armor mejorar resistencia aranazos celular,Tecnologia
2024-01-18,caracteristica precio colombia s24 s24   s24 ultra,Tecnologia
2024-01-18,apple darir intercambiar iphone valer pena,Tecnologia
2024-01-17,nocturno celular impacto tendriar sueño,Tecnologia
2024-01-14,tecnologia regreso clase,Tecnologia
2024-01-11,modelo iphone podrar actualizar él 2024,Tecnologia
2024-01-10,oneplus 12 incluira procesador visual ofrecer experiencia gaming,Tecnologia
2024-01-09,rog phone 8 pro bestia celular gamer caracteristica impresionante,Tecnologia
2024-01-05,iphone 14 pro max celular vendido mundo 2023,Tecnologia
2024-01-04,dell xps diseno unificado touchpad cristal haptico tecla,Tecnologia
2024-01-03,dispositivo movil seran presentar enero 2024,Tecnologia
2024-01-03,regalar él celular niño menor 16 año,Tecnologia
2024-01-03,amazon alexa paso paso apagar luz necesario dispositivo,Tecnologia
2024-01-03,resistente celular agua,Tecnologia
2024-01-03,limpiar celular agua conocer riesgo metodo efectivo aseo,Tecnologia
2024-01-02,google maps medir distancia punto iphone,Tecnologia
2023-12-30,consejo elegir computador jugar,Tecnologia
2023-12-29,apple reanudo venta apple watch problema legal compania,Tecnologia
2023-12-28,portatil lg gram pro sistema refrigeracion doble chip intel core ultra,Tecnologia
2023-12-28,oneplus presentar auricular buds 3 4 enero,Tecnologia
2023-12-28,refrigerador samsung flex integrar funcion reconocer clasificar alimento,Tecnologia
2023-12-28,iphone error evitar cuidar bateria,Tecnologia
2023-12-28,ipad agenda olvidese lapiz papel,Tecnologia
2023-12-27,partir pantalla celular contar reparar él cambiar él,Tecnologia
2023-12-26,oppo revelar modelo a59 conectividad 5 g carga ultrarapido,Tecnologia
2023-12-22,reducir riesgo hackeo telefono celular consejo efectivo,Tecnologia
2023-12-21,televisor tcl 98 pulgada p755 caracteristica precio colombia,Tecnologia
2023-12-20,samsung amplia servicio autorreparacion dispositivo plegabl galaxy,Tecnologia
2023-12-20,malo noticia apple navidad podrar vender mejor producto,Tecnologia
2023-12-20,llego colombia matebook d 16 pc portatil ligero huawei,Tecnologia
2023-12-20,xiaomi actualizar comedero smart pet food feeder mascota novedad,Tecnologia
2023-12-19,harman kardon lanza 2 altavoz colombia luna go   play 3,Tecnologia
2023-12-19,intel lanzar chip dominar mercado inteligencia artificial,Tecnologia
2023-12-19,celular mama regalar él navidad,Tecnologia
2023-12-19,apple podrar vender watch serie 9 watch ultra 2,Tecnologia
2023-12-18,asus zenbook s 13 oled portatil super delgado ligero,Tecnologia
2023-12-18,resena harman kardon onyx studio 8 elegancia sonoro potencia sostenible,Tecnologia
2023-12-18,celular 5 g colombia opción comprar,Tecnologia
2023-12-18,asus anunciar colombia vivobook s 15 oled colaboracion bape,Tecnologia
2023-12-18,celular xiaomi recibirir sistema operativo hypero,Tecnologia
2023-12-17,mejor aplicación smartphón 2023,Tecnologia
2023-12-16,bateria celular durar android lanzar herramienta,Tecnologia
2023-12-16,iphone descuento mejor plataforma,Tecnologia
2023-12-13,sic suspender importacion venta 8 serie motorola 5 g,Tecnologia
2023-12-13,xiaomi smart air fryer caracteristica función,Tecnologia
2023-12-12,sony xv800 sorprendente parlante sonido bateria,Tecnologia
2023-12-12,asus presentar dispositivo rog 2024 evento online 8 enero,Tecnologia
2023-12-11,pc gamer necesitar computadora juegos,Tecnologia
2023-12-11,iphone extender duracion bateria ajuste io 17,Tecnologia
2023-12-11,prohibir celular colegio mejorar resultado academico,Tecnologia
2023-12-09,reloj inteligente salir clasico,Tecnologia
2023-12-07,dispositivo apple susceptible hackeo bluetooth,Tecnologia
2023-12-07,parlante sony inalambrico fiesta xv800 caracteristica precio,Tecnologia
2023-12-06,celular vendido colombia 2023,Tecnologia
2023-12-06,apple actualizar io 172 carga qi2 disponible iphone 13 14,Tecnologia
2023-12-06,portatil congelado posible causa solucionar él,Tecnologia
2023-12-06,ciberseguridad recomendable emoji contrasena,Tecnologia
2023-12-06,usar telefono pantalla rotar peligro salud,Tecnologia
2024-02-17,tip manejar mundo abrumador chat grupal whatsapp,Tecnologia
2024-02-15,abandonar grupo whatsapp,Tecnologia
2024-02-14,traductor google truco viajar extranjero,Tecnologia
2024-02-09,conocer 3 herramienta ayudar unir documento facil,Tecnologia
2024-02-08,acceder opcion aplicacion externo dejar visualizar contenido,Tecnologia
2024-02-07,telefono android función diseñado proteger usuario llamada,Tecnologia
2024-02-06,procedimiento ayudar mejorar rendimiento computador caso,Tecnologia
2024-02-06,truco servir cuenta publica privado necesidad exponer dato programa,Tecnologia
2024-02-06,aprender finalizar sesion correo dispositivo alterar perder dato,Tecnologia
2024-02-05,beneficio drive encontrar documento lugar,Tecnologia
2024-01-29,mensaje whatsapp recibio,Tecnologia
2024-01-28,truco aprovechar maximo telefono android,Tecnologia
2024-01-25,opción personalizacion resaltar posibilidad tipografia,Tecnologia
2024-01-25,usuario recuperar correo electronico borrado accidentalmente,Tecnologia
2024-01-22,guia detallado llevar verificar aspecto general conectividad,Tecnologia
2024-01-18,metodo restaurar archivo eliminado celular paso paso,Tecnologia
2024-01-15,tutorial crear sticker whatsapp iphone salir aplicacion,Tecnologia
2024-01-12,integrar ia navegador chrome seguir recomendación,Tecnologia
2024-01-10,celular inteligencia artificial competira  iphone,Tecnologia
2024-01-03,computador celular consejo proteger dispositivo,Tecnologia
2024-01-02,enviar correo confidencial gmail,Tecnologia
2023-12-29,eltiempocom lider digital usuario pagina visto colombia comscore,Tecnologia
2023-12-27,robot realizar tarea domestica adaptar animar ia,Tecnologia
2023-12-26,cuenta streaming paso paso,Tecnologia
2023-12-21,cargar celular quedar energia alternativa,Tecnologia
2023-12-18,programar respuesta automatica gmail vacación,Tecnologia
2023-12-14,truco personalizar historia instagram,Tecnologia
2023-12-06,revelar viejo negativo fotografico instagram paso paso,Tecnologia
2023-12-05,compra internet pros contra practica comercial,Tecnologia
2023-11-30,test descubrir gmail borrar 1 diciembre,Tecnologia
2023-11-25,metodo desconocido limpiar espacio gmail recuperar almacenamiento,Tecnologia
2023-11-24,youtube ocultar anuncio relacionado licor apuesta,Tecnologia
2023-11-22,satelit starlink cielo app hora,Tecnologia
2023-11-21,truco consejo tomar mejor foto celular,Tecnologia
2023-11-17,estafa digital común identificar él,Tecnologia
2023-11-10,iphone reproducir sonido lluvia mar conciliar sueno,Tecnologia
2023-11-10,diseno audifono cuidar oido,Tecnologia
2023-11-07,truco bateria celular aguantar,Tecnologia
2023-11-06,conocer truco iphone 15 apple watch ultra 2,Tecnologia
2023-11-01,comprar black friday consejo ciberseguridad jornada,Tecnologia
2023-10-31,sospechar leer correo activar notificacion gmail,Tecnologia
2023-10-30,alguien rastrear ubicacion celular,Tecnologia
2023-10-26,consultar bateria computador portatil paso paso,Tecnologia
2023-10-26,whatsapp desktop chatear numero guardado contacto,Tecnologia
2023-10-26,paso paso eliminar dato personal google guardar usuario,Tecnologia
2023-10-23,google lanza funcion practicar ingl buscador gratuito,Tecnologia
2023-10-23,crear gmail contar paso paso,Tecnologia
2023-10-23,crear cartel estilo pixar ayuda inteligencia artificial paso paso,Tecnologia
2023-10-18,activar passkeys whatsapp celular android,Tecnologia
2023-10-17,borrar contacto lista chat frecuente whatsapp,Tecnologia
2023-10-17,carga celular error evitar recargar bateria movil,Tecnologia
2023-10-15,enlace llamado whatsapp servir crear,Tecnologia
2023-10-15,tiktok instagram truco evitar gastar dato plan celular,Tecnologia
2023-10-14,forma sacar él jugo google foto,Tecnologia
2023-10-14,recibir llamada spam consejo evitar él,Tecnologia
2023-10-12,enumerar pagina documento word,Tecnologia
2023-10-12,ideogram ai crear imagen nombre 3d mostrar,Tecnologia
2023-10-12,palabra correo electronico confundir spam,Tecnologia
2023-10-10,robar internet bloquear dispositivo conectado red wifi,Tecnologia
2023-10-10,7 pecado chatgpt actuan ciberdelincuent lanzar ataque digital,Tecnologia
2023-10-07,procesador pc marca mundo,Tecnologia
2023-10-06,activar control parental dispositivo movil televisor,Tecnologia
2023-10-04,chatgpt estilo pregunta hacer él ia,Tecnologia
2023-10-02,comprobar sitio web seguro seguir sencillo paso cerciorar él,Tecnologia
2023-10-02,edicion foto aplicación borrar objeto persona deseado,Tecnologia
2023-09-28,red social enseñar adulto mayor usar él correcto,Tecnologia
2023-09-28,aparecer mensaje video activar él whatsapp,Tecnologia
2023-09-18,whatsapp web navegador celular contar paso,Tecnologia
2023-09-18,version ios 17 apple celular compatible descargar él movil,Tecnologia
2023-09-14,ojo comprar seguro internet amor amistad,Tecnologia
2023-09-13,aplicación ayudar calcular hora trabajado,Tecnologia
2023-09-12,tip mejorar red inalambrico celular,Tecnologia
2023-09-08,navegador web actualizado optimizar consulta internet,Tecnologia
2023-09-08,compartir contraseña wifi computador,Tecnologia
2023-09-08,descargar imagen instagram pc,Tecnologia
2023-09-08,recomendable limpiar pantalla celular directamente alcohol,Tecnologia
2023-09-08,truco evitar ansiedad phubbing generado mensaje instagram,Tecnologia
2023-09-07,encontrar celular android silencio,Tecnologia
2023-09-05,dato filtrado dark web herramienta google ayudar saber él,Tecnologia
2023-08-31,necesitar grabacion pantalla celular android explicar,Tecnologia
2023-08-30,tomar foto luna iphone truco paso paso,Tecnologia
2023-08-30,cambiar cancion personal tono alarma iphone,Tecnologia
2023-08-29,significar sigla pdf usb usado tecnologia,Tecnologia
2023-08-26,truco whatsapp podrar recordar dejar parqueado vehiculo,Tecnologia
2023-08-24,hackear whatsapp paso paso recuperar él,Tecnologia
2023-08-23,tip adulto mayor caer estafa internet,Tecnologia
2023-08-23,error 404 forbidden significar solucionar,Tecnologia
2023-08-19,error 403 busqueda internet solucionar él,Tecnologia
2023-08-18,whatsapp enviar mensaje video,Tecnologia
2023-08-17,cambiar ubicacion dispositivo configuracion netflix,Tecnologia
2023-08-16,google classroom crear configurar clase,Tecnologia
2023-08-16,recibir llamada spam bloquearlas metodo,Tecnologia
2023-08-15,desconectar google inicio sesion aplicación tercero,Tecnologia
2023-08-15,liberar espacio gmail necesidad crear,Tecnologia
2023-08-14,paso paso captura pantalla smart tv aplicación,Tecnologia
2023-08-14,truco maco usuario,Tecnologia
2024-02-16,xbox anunciar llevar consola juego exclusivo,Tecnologia
2024-02-16,xbox anunciar fecha lanzamiento diablo iv game pass,Tecnologia
2024-02-15,sony lanzar titulo franquicia importante año fiscal,Tecnologia
2024-02-12,plataforma streaming ofrecer entretenimiento allo producción audiovisual,Tecnologia
2024-02-09,juego recibir critica lugar ganancia millonario titulo,Tecnologia
2024-02-09,esperar juego movil tipo free to play the division resurgence,Tecnologia
2024-02-09,titulo saga videojuego estar disponible tiempo,Tecnologia
2024-02-08,ps5 innegable ventaja antecesora 4 obsoleta,Tecnologia
2024-02-06,juego consola pc desarrollar wallride games,Tecnologia
2024-02-06,rumorar microsoft romperio exclusividad juego xbox pc,Tecnologia
2024-02-05,rumor xbox anunciar evento explosivo filtración ps5,Tecnologia
2024-02-03,the walking dead llegar call of duty temporada,Tecnologia
2024-02-01,oferta estarir disponible miembro martes 6 febrero lunes 4 marzo,Tecnologia
2024-02-01,historia desarrollar joven sufrir acoso exclusion,Tecnologia
2024-02-01,desarrolladora videojuego novedad 15 titulo plataforma ps5,Tecnologia
2024-02-01,reciente transmision developerdirect revelo alineacion continuación novedad,Tecnologia
2024-01-31,mario vs donkey kong primero impresión juego nintendo switch,Tecnologia
2024-01-31,playstation anunciar state of play 2024 15 videojuego,Tecnologia
2024-01-30,venir nintendo switch 2 cambio pantalla cautivario usuario,Tecnologia
2024-01-26,generar tanto polemica exito video juego palworld xbox,Tecnologia
2024-01-25,amd lanzar tarjeta grafico amd radeon rx 7600 xt especificación precio,Tecnologia
2024-01-25,amd lanza tecnologia generacion fotograma aumentar fps 97,Tecnologia
2024-01-25,fornite anunciar llegada solid snake pase batalla big bang,Tecnologia
2024-01-23,nvidia rtx remix plataforma modding permitir remasterizar videojuego antiguo,Tecnologia
2024-01-23,riot games desarrollador lol valorant recortar 530 empleo,Tecnologia
2024-01-23,the day before cerrar servidor poner año desarrollo tumultuoso,Tecnologia
2024-01-23,creador contenido demandar ubisoft cesar servicio linea videojuego,Tecnologia
2024-01-22,retorno triunfal prince of persia 25d,Tecnologia
2024-01-19,gameplay indián jones xbox persona,Tecnologia
2024-01-19,avatar frontiers of pandoro videojuego popular franquicia,Tecnologia
2024-01-19,call of duty detectar jugador utilizar asistente punteria,Tecnologia
2024-01-19,servicio juegos ubisoft   premium,Tecnologia
2024-01-19,racket club videojuego imperdible realidad virtual caracteristica reseña,Tecnologia
2024-01-19,videojuego llegar xbox serie pc 2024,Tecnologia
2024-01-18,palworld pokemon arma fecha llegada xbox game pass enero,Tecnologia
2024-01-18,caracteristica the last of us part ii remastered,Tecnologia
2024-01-16,f1 23 ea sports super mega baseball 4 llegar ea play enero,Tecnologia
2024-01-15,robocop regresar videojuego gratuito estilo game boy fan,Tecnologia
2024-01-12,ubisoft reconocer error version prince of persia the lost crown,Tecnologia
2024-01-10,guerra consola ano 2024,Tecnologia
2024-01-05,juego realidad virtual llegar 2024,Tecnologia
2024-01-04,steam valve lanzar astronomico cifra 14000 juego 2023,Tecnologia
2024-01-03,square enix anuncio pretender fantasy xiv durar 10 ano,Tecnologia
2024-01-02,juego saldrar 2024 playstation xbox nintendo switch,Tecnologia
2024-01-02,mickey mouse derecho autor trailer tetrico videojuego aparecer,Tecnologia
2023-12-30,consejo elegir computador jugar,Tecnologia
2023-12-29,juegos gratis enero 2024 anuncio playstation plus,Tecnologia
2023-12-26,iniciar sesion fortnite consola epic games,Tecnologia
2023-12-26,playstation forma videojuego favorito año,Tecnologia
2023-12-24,ps5 xbox nintendo switchque tipo consola accesorio regalar nochebuena,Tecnologia
2023-12-22,south park snow day anunciar fecha lanzamiento,Tecnologia
2023-12-21,rockstar gam incidencia polemico estudio videojuego,Tecnologia
2023-12-21,fantasy vii rebirth llegar ciudad misión secundario minijuego,Tecnologia
2023-12-20,navidad 2023 mejor juego pasar tiempo celulares android,Tecnologia
2023-12-20,geometry dash volver poner él moda juego,Tecnologia
2023-12-20,juego playstation 2 disfrutar celular android emulador,Tecnologia
2023-12-19,harvard ofrecer curso linea gratuito desarrollo videojuego,Tecnologia
2023-12-18,fda reconocer terapia conductual realidad virtual niño autismo,Tecnologia
2023-12-18,xbox lanzamiento llegar 11 22 diciembre,Tecnologia
2023-12-18,fecha lanzamiento gta 6 rockstar habria esconder camiseta,Tecnologia
2023-12-18,chessarama aventura ajedrecistico innovadoro nivel,Tecnologia
2023-12-18,assassins creed nexus grandioso adaptacion saga realidad virtual,Tecnologia
2023-12-17,desarrollo videojuego dinero invertir creacion,Tecnologia
2023-12-15,juego ea 2023 cifra dejar titulo ea sports fc sims 4,Tecnologia
2023-12-15,naughty dog cancelar version multijugador the last of us compañia,Tecnologia
2023-12-14,tiempo limitado steam regalar juego mes combate shooter,Tecnologia
2023-12-13,e3 despedir definitivamente decada funcionamiento,Tecnologia
2023-12-13,tribunal determinar google violo ley antimonopolio epic games ganar batalla legal,Tecnologia
2023-12-07,call of duty modern warfare iii paso audaz tropiezo,Tecnologia
2023-12-07,the game awards 2023 horario nominado destacado videojuego,Tecnologia
2023-12-07,rally ea sports wrc transformar experiencia conduccion,Tecnologia
2023-12-06,gta ver 5 referencia videojuego florida parecer ficcion real,Tecnologia
2023-12-05,lego fortnite temporada videojuego epic games,Tecnologia
2023-12-05,videojuego gratis encontrar steam disfrutar diciembre,Tecnologia
2023-12-05,grand theft auto ver llegar 2025 consola playstation xbox,Tecnologia
2023-12-05,pila videojuego estar 4 10 diciembre xbox,Tecnologia
2023-12-05,trailer oficial grand theft auto ver,Tecnologia
2023-12-04,juego regalar epic games store navidad condicion,Tecnologia
2023-12-01,conocer nino eeuu preferir regalo relacionado videojuego,Tecnologia
2023-12-01,trailer gta ver fecha oficial esperado videojuego,Tecnologia
2023-11-29,descubrir brutality mortal kombat 1 tenia idea,Tecnologia
2023-11-22,kru esports necesitar jugador equipo liga,Tecnologia
2023-11-20,proyecto rene sims 5 planear integrar multijugador intimo,Tecnologia
2023-11-20,fortnite limitar acceso edad determinado isla,Tecnologia
2023-11-20,esport ganador superdome latam 2023 colombia llevar 30000 dolar,Tecnologia
2023-11-20,aprovechar descuento black friday anunciado xbox colombia,Tecnologia
2023-11-16,conocer oferta play station black friday contar,Tecnologia
2023-11-16,catalogo juegos playstation plus mes teardown dragons,Tecnologia
2023-11-15,videojuego vendido sony playstation,Tecnologia
2023-11-15,roblox incorporar comunicacion inmersivo llamado avatar,Tecnologia
2023-11-11,gamer reto llegar generacion sector financiero,Tecnologia
2023-11-10,baldurs gate iii desarrollo caracteristica rpg larian studio,Tecnologia
2023-11-10,playstation 5 pro bestia capacidad computo filtrar detalle,Tecnologia
2023-11-09,rockstar games ia version grand theft auto ver,Tecnologia
2023-11-09,extrano televisor playstation 1 fabricar 5000 unidad,Tecnologia
2023-11-09,the legend of zelda clasico videojuego tendrar adaptacion pantalla,Tecnologia
2024-02-18,presidente petro defender reforma salud sistema actual insostenible,Politica
2024-02-18,cancilleria responder acusacion ministro rusia mercenario colombiano,Politica
2024-02-18,desmantelar seran destruir petro clan golfo,Politica
2024-02-18,secreto politico semana,Politica
2024-02-17,mandatario plantear universidad gratuito joven venezolano vivir colombia,Politica
2024-02-17,paz proyecto transicion energetico tema clave,Politica
2024-02-17,asegurar domingo emitirar decreto nombrar reemplazo ministra deporte,Politica
2024-02-17,entrevista director federacion nacional departamento gobernador boyaca,Politica
2024-02-16,mandatario participante jornada inicial conferencia seguridad,Politica
2024-02-16,declaracion venezuelo expulso pais agencia dd hh onu,Politica
2024-02-16,renuncio gustavo garcia viceministro interior gobierno presidente petro,Politica
2024-02-16,organismo internacional respetuoso proceso interno excanciller,Politica
2024-02-15,congresista pedir presidente petro pronunciar él posicion,Politica
2024-02-15,mandatario viajo canciller luis gilberto murillo,Politica
2024-02-15,miembro gabinete generar polemica intervención publica analisis,Politica
2024-02-15,canciller país reunion bogota avance adelantar proceso,Politica
2024-02-15,presidente gustavo petro asistirar conferencia seguridad munich alemania,Politica
2024-02-15,analisis injerencia indebido solicitud cidh onu eleccion fiscal,Politica
2024-02-14,petro excluir cidh onu desencadenar dictadura genocidio,Politica
2024-02-14,presidente petro elevar tono mensaje supuesto campana,Politica
2024-02-14,cargo clave faltar nombrar gobierno presidente petro,Politica
2024-02-14,presidente petro condecorar orden boyaca liceo franz,Politica
2024-02-14,presidente petro llamado onu corte eleccion fiscal,Politica
2024-02-14,papaya gustavo bolivar critico citacion marcha 8 febrero,Politica
2024-02-14,onu llamado concluir eleccion fiscal pedir gobierno brindar garantia,Politica
2024-02-13,pasaporte interesado licitacion pliego favorecer thomas greg,Politica
2024-02-13,cielo rusinque respondio fiscalia aclarar denuncia seguimiento ilegal,Politica
2024-02-13,atencion gobierno corte supremo enfrentar asedio manifestante,Politica
2024-02-13,petro confundir exmagistrado defensor ddhh pedido corte elijar fiscal,Politica
2024-02-13,72 ciento nombramiento armar benedetti embajador,Politica
2024-02-13,gobernador rechazar ola violencia pais pedir recuperar orden publico,Politica
2024-02-13,pasaporte primero observación pliego favorecer thomas greg,Politica
2024-02-12,cancilleria pidio acompañamiento secretaria transparencia licitacion,Politica
2024-02-12,desaprobacion gestion presidente petro 59 ciento opinometro,Politica
2024-02-12,cielo rusinque denunciar seguimiento vivienda llamado fiscalia,Politica
2024-02-11,presidente criticar medio bloqueo entrada corte duro 10 segundo,Politica
2024-02-11,petro pronunciar renuncia marelbys meza programa proteccion testigo,Politica
2024-02-11,presidente petro dirigirir pais domingo noche habra alocucion,Politica
2024-02-11,grave implicación asedio palacio justicia,Politica
2024-02-11,tarea presionar corte supremo ministro velasco,Politica
2024-02-10,principal aerolinea mundo vendrar colombia petro emirat,Politica
2024-02-09,reconocio colombiano responsabilidad crimen guillermo cano,Politica
2024-02-09,5 reto tendrar luis gilberto murillo recibir cancilleria agrietado,Politica
2024-02-09,version presidente petro paso palacio justicia,Politica
2024-02-09,herido secuestro presidente petro frente critica marcha,Politica
2024-02-09,gobernador pais enviir carta presidente petro pedir autonomia territorial,Politica
2024-02-09,continuar fortalecer presencia colombia canciller luis g murillo,Politica
2024-02-09,tener amenaza funcionamiento democracia presidente congreso,Politica
2024-02-09,centro democratico pedir cita relator cidh denuncia har,Politica
2024-02-09,oea amenaza interrupcion mandato presidente petro,Politica
2024-02-09,luis gilberto murillo canciller encargado suspension alvaro leyva,Politica
2024-02-08,presidente petro convoco consejo seguridad bloqueo palacio justicia,Politica
2024-02-08,familia resaltar reconocimiento harar crimen director guillermo cano,Politica
2024-02-08,daniel rojas sae director encargado dnp salida jorge ivan gonzalez,Politica
2024-02-08,secretario general oea respetar autonomia judicial,Politica
2024-02-08,petro ordenes policia presidente solicito procuradora mesura,Politica
2024-02-08,petro ordenar policia actuar persona impedir movilidad magistrado,Politica
2024-02-08,oficializar ente superacion cosa inconstitucional guajira,Politica
2024-02-08,millonario salario recibirir armar benedetti embajador fao,Politica
2024-02-08,petro lamentar suspension canciller reunion consejo seguridad,Politica
2024-02-08,armar benedetti posesiono embajador colombia fao,Politica
2024-02-08,director invima seria francisco rossi buenaventura,Politica
2024-02-08,gobierno aceptar renuncia mercedes gomez villamarin director invia,Politica
2024-02-08,quedar cargo cancilleria anuncio leyva acatar suspension,Politica
2024-02-07,canciller alvaro leyva anunciar separar cargo cumplir suspension,Politica
