date,title,type_new
,presidente petro posesiono embajador luis gilberto murillo canciller encargado director dapre,Politica
,centro democratico solicito reunion urgente comisionado cidh agresión gobierno rama judicial,Politica
,entidad funcionario gobierno petro respaldar marcha presionar corte sumar llamado presidente,Politica
,gustavo petro incentivo marcha traves red social pidiir alistar jornada profundo movilizacion,Politica
,ingrid betancourt llamo oea ocde onu condenar intento asalto palacio justicia poner peligro vida magistrado,Politica
,francia marquez posesionar viceministro designado hombre marico pensar exclusion nombramiento,Politica
,exministro hacienda petro presupuesto nacion registradora tienda barrio abrir amigo cerrar enemigo,Politica
,miguel uribe llamar victimario petro anunciar viajar washington mundo enterar él persecucion corte,Politica
,recordar senador wilson arias pacto historico izquierda defendiar corte supremo uribismo pareciar incendiar pais atacar magistrado,Politica
,fuerte reflexion paloma valencia gustavo petro presidente rodeado escandalo,Politica
,corte supremo respetar petro equivocar ataque palacio justicia golpe democracia poner pais alerta editorial vicky davila,Politica
,golpe petro asegurar querer tumbar argumentar institución cumplir constitucion,Politica
,saliente directora centro democratico destapar confesar infidencia uribe referir escandalo zuluaga garcia arizabaleta,Politica
,mocion censura ministra deporte astrid rodriguez lista renunciar saldro derrotado congreso,Politica
,semana llego corazon lagos torca ampliacion boyaca bogota contrario petro afectar reserva der hammen,Politica
,historia desacato procuraduria,Politica
,superintendente salud luis carlos leal cercano polemica exministra carolina corcho,Politica
,ivan marquez marquetalia dialogo sentido,Politica
,laura sarabia expediente quieto ministerio trabajo,Politica
,carta cesar gaviria petro,Politica
,alto costo embajada cargo ministerio relaciones exterior armar benedetti,Politica
,gustavo petro confirmar reunion consejo seguridad onu lamentable colombia aparecer canciller suspendido,Politica
,emitir decreto entregar encargo puesto director dnp tenia jorge ivan gonzalez renuncio diferencia presidente petro,Politica
,inicio reunion alto nivel presidente petro consejo seguridad onu politica paz tema clave,Politica
,everth bustamante pertenecio m19 despachar mincultura juan david correa conocimiento suficiente historia,Politica
,farc imponer jep servir alvaro uribe portazo exjef guerrillero justicia transicional,Politica
,atencion   armar benedetti embajador colombia fao jueves posesiono agradecer presidente designacion,Politica
,semana destapar plan macabro red intentar desprestigiar presionar corte supremo elegir fiscal cerebro,Politica
,juan carlos florian actor porno ir nombrar viceministro diversidad contratista gobierno petro,Politica
,viceministro trabajo despido locutor tropicana insultar presidente gustavo petro ilegal,Politica
,eliminar procuraduria consejo superior judicatura dar él facultad notario revolcon justicia proponer german vargas lleras,Politica
,colombia recibir miembro consejo seguridad onu arribar pais avance implementacion paz,Politica
,federacion nacional departamento alertar contrabando cigarrillo 2023 35 alto registrado pais,Politica
,economista marián mazzucato trabajar sae tendrar contrato gobierno petro,Politica
,francisco rossi buenaventura serio director invima 18 mes interinidad,Politica
,grupo expresidente iberoamericano rechazar persecucion politica andres pastrana gustavo petro,Politica
,cruce trino maria fernanda cabal roy barrera financiacion campaña petro justificar trampa,Politica
,juan espinal arremetir declaración petro urgente comunidad internacional seguir cerca actuación,Politica
,presidente petro suelto francisco barbosa rafaga mensaje advirtio intencionalidad fiscal sediciós,Politica
,lio desconocido video colombia pais belleza dirigido mauricio velez fotografo acompañar dama,Politica
,fuerte advertencia paloma valencia gobierno petro romper regla fiscal gastar recaudar,Politica
,licitacion pasaporte proteger intención corrupto gobierno jennifer pedraza lanzo agudo pulla petro,Politica
,jota pe hernandez cantar tabla gustavo petro advertir colombia venezuela bastar amenaza,Politica
,petro desatado francisco barbosa gente calle buscar fiscal general golpe manto institucional,Politica
,petro lanzar grave alerta fiscalia pedira juicio politico persecucion ruptura institucional llamar movilizacion,Politica
,roy barrera firme embajador reino unido plan,Politica
,tension gobierno petro semana revelar detalle inedito salida jorge ivan gonzalez planeacion funcionario enfrentado laura sarabia,Politica
,laura sarabia incomoda gobierno pasar,Politica
,pacto historico grupo purasangre,Politica
,millonario ego claudia lopez pleno año electoral destino cerca 11000 millón pesos autopromocionar él,Politica
,ministro velasco buscar voto conservador,Politica
,day vasquez confirmado principal testigo nicolas petro,Politica
,procolombio quedar comercializadora cafe,Politica
,gobernador tendran encuentro petro,Politica
,incendio genero salida director bombero ultima hora maximo tension capitan arbey trujillo,Politica
,militar retirado mandar espalda seguridad región,Politica
,director dian poner orden excesivo gabela sindicato pasar,Politica
,reforma salud voto cara debate comision septimo senado lograr imponer él gobierno,Politica
,pacto historico codo cesar pachon destapar cuestionar ministra agricultura cambio agro ver ningun,Politica
,politico reaccionar grave alerta lanzo presidente petro presunto ruptura institucional respetar democracia,Politica
,atencion presidente senado declarar sorprendido declaracion señor presidente sugerir llamado confrontacion civil,Politica
,petro respondio critico ejecutar suspension canciller leyva espera visita consejo seguridad,Politica
,atencion armar benedetti regresar gobierno petro escandalo audio pelea laura sarabia embajador fao roma,Politica
,deficit fuerza publicar proponer militar policia retiro reforzar seguridad bogota,Politica
,seguirar trabajar meta presidente gustavo petro laura sarabia pronunciar presentar renuncia gobierno,Politica
,presidente petro lanzar ristrar licitacion pasaporte alertar mantener él proteger intencion corrupto,Politica
,presidente petro posesiono cielo rusinque superintendente industria comercio,Politica
,presidente petro aceptar renuncia protocolario laura sarabia directora prosperidad social,Politica
,atencion laura sarabia directora dps presentar renuncia presidente gustavo petro,Politica
,ojo horas day vasquez alerto colombia comprar eficiente petro acepto renuncia director stalin ballestero,Politica
,fuerte malestar petrismo critica agmeth escaf gobierno estariar pedir dejar curul,Politica
,presidente petro revelo detalle captura alia gato advirtio responsable 112 homicidio,Politica
,obsesionare petro nominacion nobel paz deberiar recibir premio agencia refugiado palestino,Politica
,embajador luis gilberto murillo viaja bogota reunir él presidente gustavo petro asumiria canciller encargado,Politica
,presidente petro lanzo agudo sablazo alerto metro elevado bogota 85 demora subterraneo tenia retraso,Politica
,gustavo petro arremetio dureza fiscalia hablar reforma entidad resultado averguenzar,Politica
,polemica viaje dama terminar parada alcocer serio carnaval barranquilla,Politica
,ivan duque reaccionar perdida juego panamericano barranquilla saboteo negligencia actual gobierno,Politica
,regaño publico agudo pulla malestar gabinete antesala consejo ministro tenso presidente petro,Politica
,hernar cadavid anuncio acción judicial decision alvaro leyva acatar suspension provisional procuraduria,Politica
,fuerte carta concesion chino gerente leonida narvaez advertir grave retraso metro bogota,Politica
,presidente gustavo petro agradecio nominacion premio nobel paz seguir paz colombia,Politica
,petro revelo problema sicologico metro elevado bogota pasar él ciudadano tren frente ventana minuto,Politica
,exigir fiscal general petro pedir investigacion inmediato perfil x insulto dama veronico alcocer,Politica
,atento alvaro leyva acatar suspension procuraduria firmar 12 decreto ultima hora,Politica
,concepto cne poner problema campaña petro presidente recibir recurso fecode traves colombia humano,Politica
,presidente petro encendio alarma entregar inquietante noticia ola calor pais febrero tener duro,Politica
,bajeza contestar altura expresidente duque arremetio dureza gustavo petro exponer ex dama,Politica
,presidente petro ordenar policia actuar grupo criminal aprovechar él paz pretender tomar él territorio,Politica
,importar decir informe sociedad colombiano ingeniero orden galar metro bogota construir elevado,Politica
,fecode recurso donar extesorero gremio reiterar cheque 500 millón campaña petro,Politica
,petro respondio carta enviar netanyahu ministro israel pidio iniciar conversación liberar rehén,Politica
,exdirectivo fecode revelar torcido tramitar cheque 500 millón campaña petro espalda dinero colombia humano,Politica
,gerente empresa metro conflicto interés linea licitacion continuar,Politica
,presidente gustavo petro revelo cocaina pasar momento mercado ilegal cayo eeuu,Politica
,gobierno petro eln extender cese fuego bilateral 5 febrero,Politica
,petro hablar presidente brasil lula silva crear puesto regional atender incendio forestal,Politica
,atencion juez ordenar jaime dussan presidente colpensión reintegrar jefa relacionamiento comunicación vulnerar derecho,Politica
,presionar corte supremo martha mancera miedo convertir fiscal general encargado guillermo mendoza diago,Politica
,mocion censura ministra astrid rodriguez hacer él receso legislativo ultimo palabra presidente congreso ivan name,Politica
,coger medida reforma agrario mininterior aclarar alcance expropiación via administrativo,Politica
,hugo chavez simpatico pistola dedo pie alvaro uribe recordar encuentro expresidente venezuela,Politica
,petro compartir red fuerte mensaje gustavo bolivar criticar presionar corte elegir fiscal general,Politica
,congresista oposicion cuestionar malo resultado cese fuego eln reclamar 35 secuestrado,Politica
,concejal votado alianza verde unico partido oponer coalicion gobierno galar,Politica
,asustado exfiscal viviane morales petro afan escoger sucesor barbosa lio familia campaña,Politica
,mininterior luis fernando velasco defendio presidente petro choque fiscal barbosa malo despedida,Politica
,gremio denunciar permitir participar audiencia publica reforma salud debate,Politica
,andres forero denunciar 2300610 vacuna covid19 estar vencido pasar,Politica
,alfredo saade llamar nido rata cambio radical aspirar senado partido 2014 ocurrir centro democratico,Politica
,gobierno petro alerta especulacion precio alimento crisis ambiental incendio forestal,Politica
,recordar gustavo bolivar 2012 ojala corte supremo demorar mes elegir fiscal creer contrario,Politica
,gustavo petro astuto convirtio jefe oposicion gobierno jorge enrique robledo presidente maltrato minvivienda,Politica
,reforma gustavo bolivar aprobar él congreso pasar acabar corrupcion colombia,Politica
,presidente petro pedira indemnizacion perjuicio moral expresidente pastrana defendere honra nombre,Politica
,olmedo lopez director ungrd reconocio primar nicolas petro llego entidad recomendacion luis eduardo llinas director uiaf,Politica
,atencion presidente gustavo petro llego fiscalia diligencia conciliacion expresidente andres pastrana,Politica
,gobierno petro iniciar fase plan antiextorsion carcel ira guardia negocio telefonia,Politica
,cabal criticar favor politico contrato ungrd razon tener hacer él frente emergencia actual,Politica
,procuraduria pedir jep medida cautelar comunidad negro raizal palenquera victima dispersion social,Politica
,exsenador pacto historico cesar pachon critico ministra agricultura manejo fenomeno niño activismo desarrollo rural,Politica
,reforma salud necesitar masivo informacion ciudadano audiencia gobierno expresidente alvaro uribe,Politica
,colpensión paso 531 trabajador tercerizado 2019 crear 1025 puesto tipo 2024 aumentar nomina,Politica
,percepcion corrupcion colombia criticar pais promedio mundial indice transparencia internacional,Politica
,secuestro abominacion incompatible paz gobernadoro choco romper silencio rapto tio,Politica
,petro advirtio permitirar miembro banda aprovechar joven paz tiempo seguir trabajar capo,Politica
,defensa canciller alvaro leyva asegurar medida provisional sacar cargo constitucional,Politica
,mujer candidata cargo eleccion popular tener menor acceso financiacion partido compañero hombr,Politica
,oposicion estallar minsalud contratacion medico ancestral alerto abrir puerta chamán sobandero,Politica
,gustavo petro atacar corte fiscal justicia cumplir constitucion ley andres pastrana,Politica
,hijo piedad cordoba romper silencio fiesta 69 año quedar listo museo turbante tio extraditado maduro,Politica
,pobre presidente petro año quibdir acueducto sergio fajardo,Politica
,presidente petro recurso publico combatir pobreza abandono pacifico regalo,Politica
,pulla gareth sellar viceministro francia marquez fajardo defensa petro pobrecito enterro vida politico,Politica
,contradicción jurista rodrigo uprimny proceso eleccion fiscal corte supremo justicia,Politica
,capturar ciudadano extranjero prender fogata cerro oriental bogota,Politica
,cancilleria publico pliego requisito licitacion pasaporte pais,Politica
,fiscal francisco barbosa asegurar presidente sugirio sacar vicefiscal martha mancera cargo,Politica
,medida extraordinario establecer decreto desastre natural petro atenderar impacto fenomeno niño,Politica
,pedir ricardo roa salir presidencia ecopetrol escandalo dinero fecode campaña gustavo petro,Politica
,semana realacer sobrevuelo nemocon incendio forestal devorar 180 hectarea alcalde entrego detalle emergencia,Politica
,hija piedad cordoba narrar triste minuto final mama grite pedir ayuda pediar favor quedar,Politica
,presidente gustavo petro cancelo visita antartida atender asunto local,Politica
,gustavo bolivar poner dinamita eleccion fiscal corte proponer cambiar regla acabarl jueguito falta consenso reforma,Politica
,petro atacar fiscal barbosa ejercer sedicion señalar querer prision gente investigar él ocultar,Politica
,exfiscal martinez advertir gobierno traves francia eliminar extradicion colombiano unidos,Politica
,viajar helicoptero francia marquez arreglar via pasar casa suarez cauca denunciant zona escandalizado,Politica
,concejal centro democratico presentar proyecto evitar consumo droga parque colegio bogota,Politica
,incendio forestal colombia senado advertir problema presupuestal flota fuerza aeroespacial,Politica
,fiscal francisco barbosa responder petro llamar él sedicioso amenaza directo presidente fiscal fiscalia justicia,Politica
,viacrucis vivir habitante suarez cauca via decepcionado vicepresidenta,Politica
,minambiente advertir incalculable año necesitar recuperar frailejón quemar incendio,Politica
,gobierno anunciar accion internacional prevenir incendio forestal amazonia febrero mes riesgo selva,Politica
,alejandro gaviria presidente sae casar pelea x exministro defender señalamiento sabotear gobierno petro,Politica
,petro indignado gobierno asumir acueducto quibdo desconociendome,Politica
,29 expresidente grupo idea ivan duque condenar inhabilitacion maria corina machado venezuela legitima responsable oposicion,Politica
,gustavo petro atacar idea comunismo,Politica
,gustavo petro arremetir empresa thomas greg and sons suspension canciller alvaro leyva,Politica
,corazon fuego semana revelar encontro cerro bogota valiente bombero luchar llama,Politica
,alcalde tulua amenazado pais proteccion unp transportar camioneta amigo,Politica
,defender él proceso medio procuradora margarita cabello suspension canciller leyva,Politica
,petro elección 2026,Politica
,crisis diplomatico colombia argentino gustavo petro javier milei,Politica
,año caballero politica familiar rendir homenaje vida trayectoria carlos holmes trujillo,Politica
,consejo nacional electoral prueba bomba campaña petro,Politica
,error colombia humano aporte 500 millón pesos fecode campaña petro,Politica
,proyecto regular figura dama llegar congreso,Politica
,trampa nicolas maduro impedir candidatura maria corina machado,Politica
,cuota luis fernando velasco llegar congreso,Politica
,daniel quintero candidato presidencial 2026,Politica
,petro reunio delegacion gobierno biden riesgo maduro respetar elección libre venezuela,Politica
,repetir ratificar gustavo petro sabio dinero recibido nicolas campaña presidencial day vasquez,Politica
,senador marco rubio arremetir biden enviar delegacion hablar petro maduro logica pedir él ayuda exguerrillero m19,Politica
,gobierno gustavo petro bajo ejecución ultimo año observatorio fiscal javerián,Politica
,consejo seguridad onu visitar colombia semana orden petro suspendido canciller alvaro leyva recibirir,Politica
,gustavo bolivar gustavo petro izquierda perder prestigio nicolas maduro daniel ortega volver tomar fuerza,Politica
,representante hernan cadavid presentar accion cumplimiento llevar cabo suspension procuraduria canciller alvaro leyva,Politica
,policia retiro esquema seguridad secretario senado gregorio eljach harar trabajo casa riesgo cargo,Politica
,decreto gobierno crear 9 embajada fao cargo armar benedetti,Politica
,partido quite gustavo petro ruptura institucional convocar gente calle generar incertidumbre division miedo,Politica
,linea rojo comision septima senado tercer debate reforma salud,Politica
,juanita goebertus quejar barrida electoral nayib bukele salvador mayoria ciudadano feliz reeleccion,Politica
,alcalde galar revisar odinsa proyecto ampliacion aeropuerto dorado bogota,Politica
,balance alejandro eder mes alcaldia cali recibir ciudad momento,Politica
,lider mundo ivan duque demostrar talento dj,Politica
,mermelada verde gobierno petro,Politica
,cara piedad cordoba querido odiado semana reconstruir vida controvertido exsenadora relacion farc chavez saab,Politica
,despido colpensión entidad dejar trabajo experto pensión pleno reforma sector,Politica
,estrategia pacto historico convertir él partido unico pidio petro consenso,Politica
,gustavo petro acusar fiscal barbosa vicefiscal mancera implorar gobierno eeuu perpetuar él fiscalia,Politica
,presidente gustavo petro ordenar terminar concesion actual portuario tumaco entregar cooperativa pesca,Politica
,presidente gustavo petro pacifico deciar alguien cuidar 2022 tocar cuidar 2026,Politica
,gustavo petro defendio terna elegir fiscal general señalar corte supremo definirir mafia tomar fiscalia,Politica
,complicar situacion diplomatico colombia argentino embajador romero llamo hipocrito presidente milei,Politica
,presidente petro destapo hablar dificultad gobierno problema dirigir pais,Politica
,gobierno anunciar medida contener incendio forestal ministro realizar pmu atender emergencia,Politica
,petro despacho alertar vocero salir hablar tumbar presidente año tumbar red,Politica
,petro lanzar sablazo fiscal barbós algun apoyo gobierno extranjero ningun aspirante fiscalia,Politica
,presidente gustavo petro reacciono decision cij ordenar israel prevenir genocidio gaza triunfo humanidad,Politica
,petro ordenar ministro defensa ambiente interior justicia viajar bogota reforzar pmu incendio forestal,Politica
,bancada comision septimo mesa senado hundir dar él vuelo reforma salud,Politica
,presidente petro proponer cambiar coca coco estrategia sustitucion cultivo ilicito pacifico,Politica
,partido politico roy barrera paulino riascos pacto historico anunciar avanzar unificacion colectividad elección 2026,Politica
,antonio garcia comandante eln freno seco gobierno petro prorroga cese fuego sacar invento,Politica
,ivan name arremetir centralismo afectar pais responder siquiera apagar incendio presupuesto,Politica
,francia marquez defendio piedad cordoba haber mujer negro seguro monumento haber,Politica
,fuerte agarron catherine juvinao gustavo bolivar gobierno salir pais mano,Politica
,petro poner aprieto minsalud pedir él cifra concreto prevencion pacifico noche dato,Politica
,semana revelar resultado ronda votacion corte elegir fiscal ganar voto blanco ternada buitrago ningun voto,Politica
,citar debate control politico mindefensa ivan velasquez responder aeronave fac estariar servicio,Politica
,atencion gobierno petro elegir cielo rusinque superintendente industria comercio,Politica
,jalon oreja presidente petro gobierno pidio minagricultura poner él pila bajonazo produccion cafe,Politica
,exclusivo ministro israel benjamin netanyahu pedir presidente petro hacer esfuerzo posible liberacion secuestrado hamas,Politica
,petro suspension canciller leyva director unidad riesgo querian suspender él esperar pasar emergencia,Politica
,petro cuestionar allanamiento fecode sablazo luis carlos sarmiento poner mil millón donacion partido uribismo,Politica
,daniel briceño revelo millonario contrato amigo nicolas petro ungrd contratista hermano director uiaf,Politica
,petro aclaro unico helicoptero tierra fabricacion ruso demas atender incendio forestal,Politica
,gustavo bolivar atacar derecha pedir izquierda unir él mezquindad mantener 2026 dement anormal volver gobierno,Politica
,representante hernan cadavid presentar proyecto poder reducir requisito director entidad gobierno,Politica
,pablo escobar tenia jefe cuba negocio carlos lehder revelo encuentro raul castro,Politica
,petro lanzo alerta allanamiento fiscalia fecode buscar camino sacar presidente presidencia,Politica
,petro echar culpa alcalde generar desorden planeacion gobierno atender incendio forestal,Politica
,unidos chile peru canada ayudar colombia superar crisis ambiental incendio forestal,Politica
,chicharron ministro luis fernando velasco congreso someterir debate control politico reduccion presupuesto bombero,Politica
,catherine juvinao pedir perdon elector apoyar petro campaña salir pais mano,Politica
,representante carolina arbelaez denuncio ungrd habriar ejecutar 15 recurso tenian 2023,Politica
,atencion   presidente petro confirmar declaratorio desastre natural colombia atender emergencia incendio forestal,Politica
,petro defender canciller alvaro leyva seguir instrucción caprichoso suspension tema pasaporte,Politica
,ferreo defensa petro canciller alvaro leyva suspension procuraduria verguenza mundial tarea,Politica
,minsalud confirmar vencer millon vacuna covid19 responsabilizar territorio aplicar él,Politica
,carlos lehder calificar payaso alias popeye narcotrafico financio m19 toma palacio justicia,Politica
,petro ganar honesto carlos lehder pablo escobar m19 toma palacio justicia,Politica
,presidente petro citar consejo extraordinario ministro atender emergencia incendio forestal pais,Politica
,atencion fiscalia allano oficina fecode bogota investigar financiacion ilegal campaña petro aporte 500 millón pesos maestro,Politica
,concejal bogota poner overol defensa civil subio cerro oriental ayudar apagar incendio forestal,Politica
,exclusivo colombia renaciente dirio petro propuesta unificacion carta probar distanciamiento,Politica
,jaime andres beltran alcalde bucaramanga gobierno plata dinero ciudad,Politica
,petro impactado testimonio exdirector carcel modelo desaparecido penal terminar carne molido expendio,Politica
,carlos lehder tiempo pedir él minjusticia nestor osuna conformar comision investigar relacion alfonso lopez michelsen cartel medellin,Politica
,presidente petro anuncio gobierno asumirir plan mitigacion fenomeno niño región poder,Politica
,carlos lehder ratificar expresidente alfonso lopez michelsen recibio dinero cartel medellin ver plata ojo,Politica
,2022 fac pedir gobierno recurso mantenimiento unidad incendio ayer asignar dinero denuncio katherine miranda,Politica
,partido conservador reafirmar votar reforma salud gustavo petro senado poner riesgo vida colombiano,Politica
,atento petro insistio elegir gobierno progresista advertir 200 año olvido solucionar año,Politica
,maria fernanda cabal serio duda muerte piedad cordoba sabiar cosa,Politica
,exgobernador santander hugo aguilar revelo integrante eln autodefensa ayudar construccion panachi,Politica
,pedir alcalde galar establecer pasaje gratuito transmilenio carro bogota,Politica
,enviar carta alcalde galar pedir él agilizar expedicion decreto prohibir consumo droga bogota,Politica
,petro llego pacifico asistir evento publico toma region tumaco equipo gobierno,Politica
,david luna advertir presidente petrir orquestar posibilidad constitucional juridico quedar él,Politica
,galar revelar foro colombia 2024 retraso autorizar plan vuelo helicoptero frenar incendio bogota,Politica
,jaime andres beltran alcalde bucaramanga petro gobernar dar él espalda región,Politica
,federico gutierrez advertir falta comunicacion gobierno foro colombia presidente contacto,Politica
,concejal cali andres escobar confeso favor baja captura fuerza publicar ahorrar gasto estatal,Politica
,maria fernanda cabal foro colombia gobierno peligro supervivencia colombia directo despeñadero,Politica
,david luna arremetir pacto historico foro colombia interesar salud buscar controlar gasto publico,Politica
,catherine juvinao debatir reforma salud corte constitucional estar llamar gente incendiar corte,Politica
,candente panel congresista iniciativa gobierno petro revivir critica reforma salud,Politica
,catherine juvinao reaccionar comentario jota pe hernandez muerte piedad cordoba rechazo actitud violento,Politica
,luna advertir foro colombia reforma salud pasar gobierno comprar conciencia senador,Politica
,fuerza paz partido roy barrera presidente pidiir gobernar extremismo,Politica
,enrique peñalosa sendero mariposa habrio servir controlar incendio bogota claudia lopez freno,Politica
