date,title,type_new
,presidente petro posesiono laura sarabia directora prosperidad social presupuesto manejar,Politica
,maquina noticia falso daniel briceño desmintio publicacion hecho presidente gustavo petro,Politica
,urgente fernando petro hermano gustavo petro lograr millon voto elección impulsado criminal carcel,Politica
,fiscalia pedir carcel policia vinculado chuzada caso sarabia,Politica
,sintoma asperger trastorno petro hermano,Politica
,salvavidas presidente petro hermano juan fernando petro comparar messi,Politica
,aumento precio luz colombia diego molano responder duro petro propuesta,Politica
,juan fernando petro revelo detalle sindrome asperger padecerio presidente petro diagnosticar verdaderamente,Politica
,grave hermano gustavo petro destapo trastorno psicologico presidente,Politica
,poligrafo marelbys meza hablar episodio robo casa armar benedetti,Politica
,oposicion replicar reciente alocucion presidente petro quedar atrapado discurso poder salir,Politica
,candidato fantasma colar tarjeton alcaldia cali,Politica
,laura sarabia mujer presidente petro perder gobierno,Politica
,carlos fernando galar pronuncio propuesta gobierno petro transporte publico gratis,Politica
,claro luz roldan gobernadora valle mantener furia tulio gomez aceptar retractación tibio,Politica
,habra recesion crecer previsto palabra ministro hacienda ricardo bonilla economia colombiano,Politica
,enfrentamiento tulio gomez pedir procuraduria investigar gobernadora valle claro luz roldan razón,Politica
,tenia experiencia corrupcion bromeo gustavo bolivar caso nicolas petro,Politica
,sindicato ministerio salud denunciar amenaza supuesto alianza oposicion,Politica
,presidente gustavo petro defender terna fiscal preferir elegir amigo,Politica
,petro enfermedad habito ir él parranda beber revelar supuesto razon presidente faltar tanto evento,Politica
,marketing digital campaña politica ad portas elección,Politica
,gustavo petro demostrar talante antidemocratico miguel uribe criticar presidente querer imponer agenda congreso,Politica
,congresista aparte ganar 43 millón mensual recibir pago gasolina camioneta,Politica
,alocución presidente petro encender duro debate politico razon,Politica
,miguel uribe proponer alianza sacar gustavo bolivar contienda electoral alcaldia bogota,Politica
,adriana cordoba esposa exalcalde bogota antanas mockus embajadora colombia dinamarca,Politica
,cali mesa participacion victima,Politica
,control maria andrea nieto candidato alcaldia cartagena,Politica
,matar diego felipe becerra criminal petro asesinato grafitero manos policia,Politica
,ingrid betancourt lanzar petro seguir secuestrar fuerza publicar,Politica
,empresario español petro acusar querer tumbar gobierno,Politica
,moe alertar escaso mes elección candidatura reportado correctamente cifra financiacion,Politica
,victoria militar reemplazo economia ilicitar licita petro combate argelia cauca,Politica
,revelar fecodir donar 500 millón campaña gustavo petro reportado cne,Politica
,elección 2023 candidato liderar intencion voto alcaldia bogota cali medellin bucaramanga barranquilla,Politica
,presidente petro tildo bruto querer tumbar gobierno recoger dinero empresario español,Politica
,alcaldia cali intencion voto caleño mes elección,Politica
,alcaldia bogota carlos fernando galan gustavo bolivar candidato fuerte ganar encuesta invamer,Politica
,cali monitorear cese fuego gobierno eln,Politica
,exigencia marquetalia dialogar gobierno gustavo petro asegurar guerrilla elevado calidad politica,Politica
,enredar reforma salud camara representante aprobo subcomision concertar texto,Politica
,representante christian garces pedir informacion dapre protocolo adición benedetti sugirio presidente tendriar problema droga,Politica
,tener dignidad duro reclamo gustavo bolivar alcaldesa claudia lopez,Politica
,duro comentario jaime bayly gustavo petro lento depresivo pasear chachara babosa,Politica
,gustavo petro quedar jefa gabinete decision cielo rusinque estare momento gobierno,Politica
,piedad cordoba arremetir miguel polo polo cerebro,Politica
,machista caballero ingrid betancourt comentario gustavo petro romper cama,Politica
,confirmar orden captura fiscal monsalve venezuela delito acusar,Politica
,cielo rusinque serio jefa gabinete presidente gustavo petro,Politica
,congresista advertir proyecto infraestructura valle veriir afectado falta recurso presupuesto 2024,Politica
,tremendo revolcon presidente petro anunciar transformacion banco agrario,Politica
,pasar proceso judicial laura sarabia venir,Politica
,presidencia publico hoja vida laura sarabia directora departamento administrativo prosperidad social,Politica
,ojo proyecto ley buscar resolver situacion militar mayor 24 año colombia,Politica
,universidad paz otorgar titulo honoris causa presidente gustavo petro,Politica
,romperiar relacion veronica alcocer exasesora eva ferrer mejor amiga historia serio secreto,Politica
,carlos alonso lucio confirmar version ingrid betancourt crisis gustavo petro belgica ver estar,Politica
,alza acpm orden fmi presidente gustavo petro cuestionar manifestante alza gasolina,Politica
,alejandro eder wilson ruiz unirar candidatura alcaldia cali,Politica
,mabel lara gerente campaña diana rojo candidata alcaldia cali,Politica
,presidente petro celebro condena exmilitar asesinar victor jara caida allende chile,Politica
,atencion corte supremo justicia abrir investigacion formal armar benedetti,Politica
,falta caracter gobernar acusacion peñalosa presidente petro ajuste precio diesel,Politica
,ministro salud asegurar dejar prestar servicio reunion eps adres acemi antesala debate reforma,Politica
,millonario salario laura sarabia directora prosperidad social regreso gobierno gustavo petro,Politica
,persona cercano gustavo petro adiccion depresión congresista pedir presidente presente examen medico,Politica
,mensaje desafio institucionalidad seguir critica nombramiento sarabia gobierno,Politica
,gustavo petro reaccionar comentario ingrid betancourt supuesto adiccion,Politica
,laura sarabia volver gobierno cargo,Politica
,dama veronico alcocer defender critica campaña red social,Politica
,carlos alonso lucio cerro ojo recordar ver petro desconectado conciencia pense trago,Politica
,presidente petro convirtio mandatario viajar año gobierno,Politica
,imaginar gustavo petro mary luz herran aclaro relacion presidente,Politica
,adormecer dar él tranquilidad falso ingrid betancourt refiriir futuro uribe presidente petro,Politica
,pasar colombia informacion unidos entregar caso odebrecht,Politica
,alvaro uribe cali presentar candidato centro democratico proxima elección,Politica
,presidente garantizar colombiano sano juicio advirtio ingrid betancourt salud gustavo petro,Politica
,enrique gomez tildar hipocrito mensaje veronica alcocer inmoralidad conocer limit,Politica
,intimidar federico gutierrez presunto persecucion candidato medellin,Politica
,autoridad asegurar riesgo elección octubre medellin valle aburrir,Politica
,petro cumplir narco para guerrilla duro criticar andres pastrana presidente,Politica
,futuro ley reconciliacion nacional propuesto presidente petro,Politica
,oposicion tomar serio mentirós gustavo bolivar ataque paloma valencia,Politica
,exclusivo alejandro eder wilson ruiz buscar alianza alcaldia cali quedar candidatura,Politica
,gastelo mil joven honesto fuerte enfrentamiento presidente petro paloma valencia,Politica
,jep llamar declarar alias otoniel excomandante clan golfo,Politica
,expresidente uribe advertir consecuencia reforma laboral pedir gobierno recapacitar,Politica
,roberto ortiz intencion voto alcaldia cali llego techo analista,Politica
,control maria andrea nieto candidato alcaldia medellin,Politica
,atencion presidente gustavo petro anuncio ley reconciliacion nacional ver él beneficiado narco,Politica
,maria fernanda cabal arremetir presidente petro ausencia evento respetar pais,Politica
,esperar maria fernanda cabal destacar numeroso error trino presidente petro,Politica
,atencion defensa presidente gustavo petro pidio nulidad investigacion escandalo petrovideo,Politica
,techo roberto analizar experto resultado encuesta alcaldia cali,Politica
,liderazgo mujer francia marquez marta lucia ramirez colgar retrato mujer vicepresidente pais,Politica
,encuesta cnc pais alcaldia cali chontico liderar alejandro eder bajar miyerlandi estanco diana rojo desplomar,Politica
,catherine juvinao refiriir proyecto reduccion salario congreso orangutan orangután,Politica
,nestor humberto martinez arremetir canciller alvaro leyva propuesta lavar dinero guerrilla,Politica
,expresidente reprendir escandalo odebrecht guardar esperanza juan manuel santos lucidez valor reconocer error,Politica
,expresidente cesar gaviria culpar gobierno petro crisis eps ineficiente gestion conduccion,Politica
,farsa construir paz maria fernanda cabal explicar argumento corte tumbar paz,Politica
,creer revelar nombre senador recibir dinero pagar gasolina mayoria pacto historico,Politica
,grosera encerrona gustavo petro explicar evento,Politica
,senado aprobo debate proyecto reducir salario congresista,Politica
,eduardo valencia ospín caleño liderar victoria colombia condecorar orden boyaca,Politica
,atencion presidente petro pidio jep reconocer victima revelación exparamilitar alias macaco habrian querido destruir él,Politica
,pese citado fiscalia exjefe gabinete petro laura sarabia admitir posibilidad regresar gobierno,Politica
,gobierno panameño aclarar gustavo petro canal panama funcionar normalidad,Politica
,nicolas petro revelo hablar papa visita gira torno politica,Politica
,identificar tarjetón votar elección regional 2023,Politica
,ilegal visita presidente petro hijo nicolas,Politica
,inconstitucional procuradora margarita cabello ley paz,Politica
,escandalo odebrecht amparo ceron propuesto petro terna fiscal general causa revuelo nacional,Politica
,reunion laura sarabia organizo presidente abogado nicolas petro,Politica
,audiencia corte constitucional evaluar futuro paz detalle,Politica
,polemico trino day vasquez visita gustavo petro hijo nicolas escribio,Politica
,gustavo petro visito hijo hablar presidente nicolas,Politica
,lapsus candidato alcaldia medellin generar risa red,Politica
,ivan cepeda romper silencio criticar congresista pedir examen medico presidente,Politica
,alvaro uribe rompio silencio hablar odebrecht juan manuel santos,Politica
,lapsus llover critica albert corredor candidato alcaldia medellin acostar dormir,Politica
,empezar agua pacto historico,Politica
,ver cali vuelta miercoles duro sablazo maurice armitage jorge ivan ospina alcaldia,Politica
,miedo salir estabar esperar pegarte pepazo cabeza policias acusado gustavo bolivar twitter amenazado muerte,Politica
,maurice armitage jorge ivan ospina aliar creer tonto wilson ruiz arremetir llamar politiqueria,Politica
,nicolas petro enviar mensaje laura ojeda revivir controversial tema papa,Politica
,armitage destapar wilson ruiz conocer … doler tipo ministro prestar mentira,Politica
,ruta dinero sucio habria entrar campaña santos victor lopez empresario carro lujo mover cerca millon dolar odebrecht,Politica
,ciudad necesitar politiqueria hastiado   wilson ruiz responder maurice armitage,Politica
,proyecto obligariar presidente gustavo petro alcaldes gobernador practicar él examen medico determinar lucidez mental,Politica
,oso marbelle arremetir juan manuel santos pedir devolver nobel paz,Politica
,ultimatum petro remezon ministerial,Politica
,entregar donacion senadora isabel zuleta defender indagación procuraduria,Politica
,tarjeton elección gobernacion valle quedar definido orden candidato,Politica
,elección colombia 2023 dramatica historia candidato campaña situacion orden publico pais,Politica
,campaña desprestigio equipo juridico tulio gomez responder presunto inhabilidad candidato,Politica
,presidente petro criticar netflix semana asesinar policia cauca,Politica
,gobernador meta meter él presidente petro salio defensa ministro interior luis fernando velasco,Politica
,gobernador meta arremetio ministro interior llamar hipocrita incompetente,Politica
,presidente petro hablar duro golpe grupo criminal operativo,Politica
,polemica senadoro isabel zuleta pacto historico bajar él sueldo comparar futbolista,Politica
,polemico mensaje gustavo petro marcha oposicion colombia,Politica
,ciudad mundo cafe pablo escobar polemica afirmacion presidente gustavo petro caficultor,Politica
,increible senadora karina espinoso pedir quedar salario definir congreso,Politica
,comision acusación investigar presidente gustavo petro,Politica
,control maria andrea nieto candidato alcaldia cali prometer,Politica
,gobernador pedir salida luis fernando velasco mininterior esperar ministro respetar región autoridad,Politica
,esposa maximo noriega reaccionar recibir certificado fiscalia,Politica
,tarjetón electoral barranquilla atlantico quedar definido orden candidato,Politica
,caso odebrecht revelar detalle multinacional plata campaña presidencial santo soborno   80000 millón,Politica
,apto cargo partido politico unir pedir él presidente gustavo petro realizar examen medico,Politica
,juan manuel santos cuerda flojo odebrecht prueba salir luz entrada dinero sucio campaña,Politica
,elección colombia 2023 quedar ubicado candidato alcaldia cali gobernacion valle,Politica
,paloma valencia calificar incapaz gobierno petro afrontar problema seguridad pais,Politica
,piso 22″ angustia gustavo bolivar fuerte temblor registrado bogota,Politica
,confirmar plan eln atentar maria fernanda cabal general r zapateiro gobierno petro sabio mes,Politica
,atencion corte constitucional insistir congreso regular eutanasia,Politica
,choque luis fernando velasco gobernador,Politica
,acido duro comentario ingrid betancourt presidente petro acabar,Politica
,petro despacho german bahamon gerente federacion cafetero ganar 200 millón,Politica
,polemica comparacion petro foro cafetero cocaina petroleo carbon funcionar,Politica
,paso proyecto ley regular testeo animal investigación colombia,Politica
,ministerio mina acato orden gustavo petro pidio renuncia 3 funcionario,Politica
,polo polo despachar ministro defensa ivan velasquez pelele,Politica
,presidente petro defendio comandante ejercito habria ocultar mes plan asesinar fiscal,Politica
,juan manuel santos defendera supuesto soborno odebrecht   encargare demostrar calumnia infame,Politica
,senador trabajar prostituta hamburgo frase piedad cordoba causo polemico,Politica
,day vasquez reaparecer fuerte trino jugar candela dirigido,Politica
,gustavo petro ordenar ministro pedir renuncia director instituto entidad,Politica
,atencion cne abrio investigacion gustavo bolivar poner jaque candidatura alcaldia bogota,Politica
,recoger firma solicitar comision acusación investigar petro campaña presidencial 2022,Politica
,procuradora margarita cabello cuestionar mancuso gestor paz deuda justicia,Politica
,alvaro uribe responder gustavo bolivar señalo pagar impuesto bogota deberiar elegir alcalde,Politica
,tiempo valient frase campaña principal legado candidato presidencial asesinado ecuador,Politica
,cabal indignado desinter gobierno plan eln llamar,Politica
,cambiar lugar votacion elección colombia 2023 tramite,Politica
,colombia avanzar caos fuerte pulla peñalosa presidente petro,Politica
,gobierno nacional pedir debate mundial derecho huelga llevar corte internacional justicia,Politica
,anular eleccion cesar pachon senador doble militancia,Politica
,armar benedetti reaparecer colombia guardia foto exembajador cita justicia,Politica
,sandra navarro esposa alia sobrino revelo entrar dinero procedencia campaña presidente gustavo petro,Politica
,pense llegar tanto bajeza petro negar acusación financiacion narco campaña presidencial casanare,Politica
,gustavo bolivar pequeño fortuna permitir renunciar congresista pese salario,Politica
,consejo anular sancion inhabilitir exgobernador valle juan carlos abadia 10 año,Politica
,burlar declarar emergencia economico guajira presidente petro voraz incendio hawai,Politica
,narco habriir apoyar campaña presidencial gustavo petro casanare,Politica
,elección alcaldia bogota 2023 ganar perder debate,Politica
,divertido mem dejar debate candidato alcaldia bogota,Politica
,bolivar dejar evidencia desconocer borrador decreto quedar pagar 1000000 matar maria fernanda cabal,Politica
,pasar camara debate alcaldia bogota 2023,Politica
,habra pico placa moto bogota responder candidato alcaldia debate,Politica
,duro respuesta daniel briceño encuesta alcaldesa claudia lopez inseguridad bogota,Politica
,inviable pacto nacional proponer presidente petro analista,Politica
,jorge enrique robledo proponer pasaje cero bogota pagar transmilenio,Politica
,  vivo debate candidato alcaldia bogota 2023 resumen mejor momento cara cara,Politica
,claudia lopez proponer bogota policia mejorar seguridad viable,Politica
,abogado daniel briceño cuestionar gustavo bolivar promesa donar sueldo elegir alcalde bogota,Politica
,papel linea proponer rodrigo lara participacion clave reserva fuerza publicar bogota,Politica
,rodrigo lara hablar guerra hibrida cali debate alcaldia bogota referir,Politica
,duro agarron rodrigo lara jorge enrique robledo debate alcaldia bogota,Politica
,carlos fernando galan lanza duro pulla alcaldesa politica seguridad claudia lopez fracaso,Politica
,conocer candidato luchar llegar alcaldia bogota,Politica
,diana rojo calificar bandido juan carlos abadia reconocer reunio oficina maurice armitage,Politica
,reunion largo engañado pidiir apoyo polemico exgobernador juan carlos abadia revelar detalle cita diana rojo candidata alcaldia cali,Politica
,diana rojo responder juan carlos abadia miente pedir cita reunion realacer candidata acepto,Politica
,presidente petro anunciar consejo seguridad cauca reciente ataque violento fuerza publicar,Politica
,diana rojo candidata alcaldia cali reunion secreto cuestionado exgobernador valle juan carlos abadia candidatura independiente,Politica
,francia dejar responder vicepresidenta pregunta brava resentido,Politica
,oficial hombre mujer irar alcaldia cali conozca fuerza politica respaldar,Politica
,debate alcaldia bogota 2023 cara cara candidato elección,Politica
,colombia votar debate candidato alcaldia bogota,Politica
,presidente petro revelo retraso vuelo brasil colombia hablar desaparicion,Politica
,nicolas petro amenazado contar presunto dinero irregular campaña presidencial,Politica
,caso odebrecht   armar benedetti hablar investigacion grupo aval corficolombiana denunciar,Politica
,defendio presidente petro emergencia economico guajira corte constitucional,Politica
,atencion presidente gustavo petro hablar mandatario ecuador guillermo lasso asesinato fernando villavicencio aca detalle,Politica
,presidente petro respondio fallo corte constitucional sanción funcionario procuraduria,Politica
,avanzar audiencia publicar corte constitucional declaracion emergencia economico guajira petro defendio posicion,Politica
,miserable duro mensaje fiscal francisco barbosa comisionado paz danilo rodar dudar atentado eln,Politica
,poderoso dinero presidente gustavo petro cuestionar justicia caso odebrecht,Politica
,jota pe hernandez arremetio presidente petro ausencia publica adiccion permitir responder él pais,Politica
,cuenta cuadrar replicar oposicion discurso presidente petro año gobierno,Politica
,gustavo bolivar culpar ultraderecha asesinato candidato presidencial ecuador fernando villavicencio,Politica
,eln negar nuevamente atentado maria fernanda cabal general eduardo zapateiro fiscal barbós,Politica
,escandalo gustavo petro pagar 12 millón anual directo joven salir peligroso grupo criminal,Politica
,enrique gomez arremetio dialogo eln gobierno colombia tratar mujer cachona,Politica
,consejo nacional electoral pidiir prueba financiamiento campaña gustavo petro presidente,Politica
,unico campaña reportar dios mandar alejandro eder lanzar duro mensaje contendiente,Politica
,carlos alonso lucio exmilitante m19 reclamar juicio politico presidente petro,Politica
,gustavo petro presidente colombiano aparecio saber él 24 hora,Politica
,ver termino luis carlos galar colombia periodista predecir tragico asesinato fernando villavicencio,Politica
,fernando villavicencio asesinar destapo grave denuncia presuntamente involucrar nicolas petro,Politica
,gobierno petro deuda promesa luchar corrupcion transparencia colombia,Politica
,oficina alto comisionado paz rechazar amenaza plan atentar vida fiscal general nacion,Politica
,doler paz mortificar tregua gustavo bolivar acusar oposicion querer sabotear dialogo eln,Politica
,  asamblea atlantico aceptar renuncia nicolas petro,Politica
,leandro castellano exarquero santa fe lanzo concejo bogota propuesta,Politica
,ministro defensa ivan velasquez revelar hipotesis atentado eln fiscal barbós,Politica
,volveran iva colombia avanzar proyecto buscar implementar él,Politica
,razón andres gomez alcalde sincelejo,Politica
,expresidente uribe pronunciar supuesto amenaza eln fiscal barbosa,Politica
,año país viajar presidente gustavo petro,Politica
,procuraduria confirmar exalcalde rodolfo hernandez suspender 4 mes irrespetar veedor ciudadano,Politica
,politico centro democratico alerta hijo hermana ministra trabajar caso nepotismo,Politica
,ricardo roa hablar nicolas petro campaña presidencial sabio recibiar dinero,Politica
,valle cauca año gobierno petro,Politica
,caleña pedir revocatoria candidatura gustavo bolivar alcaldia bogota,Politica
,insolito gustavo petro critico viajero frecuente avion pese historial presidente viajero,Politica
,presidente gustavo petro proponer crear otar amazonica defender selva arma,Politica
,agenda presidente gustavo petro cumbre amazonia brasil,Politica
,dibujar paraiso inexistente enrique gomez discurso año gobierno presidente gustavo petro,Politica
,perdi querer aliar yo ningun politiquero rodolfo hernandez balance gobierno petro,Politica
,gobierno petro año signado escandalo,Politica
,fuerte pronunciamiento oposicion año petro presidente pedir mejorar,Politica
,reforma laboral incluirir punto sector discutir,Politica
,año sabroso agridulce analisis cnn francia marquez construir legado politico,Politica
,president pagar algun familiar ministro salud caso nicolas petro,Politica
,escandalo abogado miguel angel rio demandar agmeth escaf corte supremo,Politica
,gustavo petro acusar fuerza publicar simplemente mentira,Politica
,gabinete presidente gustavo petro apoyo gestion millón colombiano,Politica
,mintrabajo anuncio proximo semana radicar reforma laboral punto incluido,Politica
,reaccionar sector politico año gustavo petro presidente,Politica
,transcurrir 365 gustavo petro presidencia,Politica
,agmeth escaf defender acusación nicolas petro venir contar,Politica
,jose felix lafaurie refiriir proceso paz colombia,Politica
,desmentir vicepresidenta francia marquez hacer exigencia ambulancia seguridad,Politica
,alegrar confirmar alfonso prada inocencia mención escandalo nicolas petro,Politica
,vender él alcaldia politiqueria candidata diana rojo,Politica
,recuperar gobernabilidad reto gustavo petro restar mandato analista,Politica
,day vasquez barranquilla recibir libertad condicional,Politica
,obsesionado reforma preferir cambiar relacion politico presidente petro proposito año gobierno,Politica
,error humano nicolas alcocer petro pronuncio caso hermano,Politica
,nicolas petro renuncio diputado asamblea atlantico,Politica
,angelica lozano jota pe hernandez pedir partido verde salir coalicion gobierno petro,Politica
,importante justicia valore recompense reacción decision juez dejar libertad nicolas petro,Politica
,problema hermano nicolas petro revelo relacion andrea antonella sofia andres nicolas,Politica
,relacion nicolas petro ministro gobierno petro hijo presidente contar,Politica
,maximo noriega nicolas petro tildar victima excandidato gobernacion,Politica
,nicolas petro sacar luz papel laura sarabia campaña presidente gustavo petro,Politica
,nicolas petro desmentir teoria iria vivir cuba descartar idea salir pais,Politica
,nicolas petro preguntar publicidad barranquilla favor campaña federico gutierrez reportar cuestionamiento,Politica
,oscar camacho aporte dinero sucio campaña presidencial petro nicolas,Politica
,nicolas petro relacion euclid torre campaña presidencial padre,Politica
,ojala algun perdonar petro revelación hijo nicolas,Politica
,veronico alcocer presidenta colombia nicolas petro nombre salir relucir escandalo,Politica
,miguel angel rio campaña petro hijo presidente nicolas petro,Politica
,nicolas petro protagonico rol veronica alcocer relacion papa presidente gustavo petro,Politica
,nicolas petro papa gerente campaña sabian dinero recibir daysuris santander lopesierra gabriel hilsaca,Politica
,novelon meter nicolas petro exministro alfonso prada engañar day,Politica
,golpe duro nicolas petro confesar revelar sintiir papa asegurar criar,Politica
,nicolas petro confesar sentir abandonado razon seguir,Politica
,inmolar papa nicolas petro revelar explosivo detalle campaña presidente gustavo petro,Politica
,pasar asamblea atlantico renuncia nicolas petro,Politica
,negociación abordar seriedad monseñor henao proposito cese fuego eln,Politica
,nicolas petro day vasquez quedar libertad audiencia definitivo medida aseguramiento,Politica
,hombre 100 millón nicolas petro,Politica
,procuradora margarita cabello constituyo agencia especial intervenir proceso presidente gustavo petro,Politica
,reflexion gobernadora valle claro luz roldan caso nicolas petro,Politica
,petro inocente expresidente ernesto samper ingreso dinero ilegal ambos campaña presidencial,Politica
,reacción oposicion investigacion nicolas petro,Politica
,pacto historico oficializo ferney lozano candidato gobernacion valle cauca,Politica
,terna fiscal ver afectado escandalo nicolas petro,Politica
,empresario politico caribe salpicado caso nicolas petro,Politica
